question,body,A,B,C,D,E,year,question_number,test,answer,language
QUESTÃO 91,"A maioria das pessoas fica com a visão embaçada ao abrir os olhos debaixo dʼágua. Mas há uma exceção: o povo moken, que habita a costa da Tailândia.  Essa característica se deve principalmente à adaptabilidade do olho e à plasticidade do cérebro, o que significa que você também, com algum treinamento, poderia enxergar relativamente bem debaixo dʼágua. Estudos mostraram que as pupilas de olhos de indivíduos moken sofrem redução significativa debaixo dʼágua, o que faz com que os raios luminosos incidam quase paralelamente ao eixo óptico da pupila. A acuidade visual associada à redução das pupilas é fisicamente explicada pela diminuição",da intensidade luminosa incidente na retina.,da difração dos feixes luminosos que atravessam  a pupila.,da intensidade dos feixes luminosos em uma direção por polarização.,do desvio dos feixes luminosos refratados no interior do olho.,das reflexões dos feixes luminosos no interior  do olho.,2019,91,CN,D,portuguese
QUESTÃO 92,"O “The Kidney Project” é um projeto realizado por cientistas que pretendem desenvolver um rim biônico que executará a maioria das funções biológicas do órgão. O rim biônico possuirá duas partes que incorporam recentes avanços de nanotecnologia, filtração de membrana e biologia celular. Esse projeto significará uma grande melhoria na qualidade de vida para aquelas pessoas que dependem da hemodiálise para sobrevivência. O dispositivo criado promoverá diretamente a",remoção de ureia.,excreção de lipídios.,síntese de vasopressina.,transformação de amônia.,fabricação de aldosterona.,2019,92,CN,A,portuguese
QUESTÃO 93,"Um experimento simples, que pode ser realizado com materiais encontrados em casa, é realizado da seguinte forma: adiciona-se um volume de etanol em um copo de vidro e, em seguida, uma folha de papel. Com o passar do tempo, observa-se um comportamento peculiar: o etanol se desloca sobre a superfície do papel, superando a gravidade que o atrai no sentido oposto, como mostra a imagem. Para parte dos estudantes, isso ocorre por causa da absorção do líquido pelo papel. Descrição da imagem: Copo de vidro que contém próximo de um quarto de seu volume de etanol, no qual está mergulhado verticalmente um pedaço retangular de papel de filtro, que encosta no fundo do copo. Observa-se que o etanol molha o papel de filtro acima do nível do líquido, na imediação da metade do copo. Do ponto de vista científico, o que explica o movimento do líquido é a",evaporação do líquido.,diferença de densidades.,reação química com o papel.,capilaridade nos poros do papel.,resistência ao escoamento do líquido.,2019,93,CN,D,portuguese
QUESTÃO 94,"Tratado sobre a luz Quando se considera a extrema velocidade com que a luz se espalha por todos os lados e que, quando vêm de diferentes lugares, mesmo totalmente opostos,  [os raios luminosos] se atravessam uns aos outros sem se atrapalharem, compreende-se que, quando vemos um objeto luminoso, isso não poderia ocorrer pelo transporte de uma matéria que venha do objeto até nós, como uma flecha ou bala atravessa o ar; pois certamente isso repugna bastante a essas duas propriedades da luz, principalmente a última. O texto contesta que concepção acerca do comportamento da luz?","O entendimento de que a luz precisa de um meio de propagação, difundido pelos defensores da existência do éter.","O modelo ondulatório para a luz, o qual  considera a possibilidade de interferência entre  feixes luminosos.","O modelo corpuscular defendido por Newton,  que descreve a luz como um feixe de partículas.","A crença na velocidade infinita da luz, defendida pela maioria dos filósofos gregos.",A ideia def endida pelos gregos de que a luz era pr oduzida pelos olhos.,2019,94,CN,C,portuguese
QUESTÃO 95,"Um dos parâmetros de controle de qualidade de polpas de frutas destinadas ao consumo como bebida é a acidez total expressa em ácido cítrico, que corresponde à massa dessa substância em 100 gramas de polpa de fruta. O ácido cítrico é uma molécula orgânica que apresenta três hidrogênios ionizáveis (ácido triprótico) e massa molar 192 gramas por mol . O quadro indica o valor mínimo desse parâmetro de qualidade para polpas comerciais de algumas frutas. Descrição do quadro: Quadro com os tipos de polpa de fruta e seus respectivos valores mínimos da acidez total expressa em ácido cítrico, em grama por 100 gramas. Acerola: 0,8 Caju: 0,3 Cupuaçu: 1,5 Graviola: 0,6 Maracujá: 2,5 A acidez total expressa em ácido cítrico de uma amostra comercial de polpa de fruta foi determinada.  No procedimento, adicionou-se água destilada a 2,2 gramas  da amostra e, após a solubilização do ácido cítrico, o sólido remanescente foi filtrado. A solução obtida foi titulada com solução de hidróxido de sódio 0,01 mol por litro , em que se consumiram 24 mililitros da solução básica (titulante). Entre as listadas, a amostra analisada pode ser de qual polpa de fruta?",Apenas caju.,Apenas maracujá.,Caju ou graviola.,Acerola ou cupuaçu.,Cupuaçu ou graviola.,2019,95,CN,C,portuguese
QUESTÃO 96,"Uma cozinheira colocou sal a mais no feijão que estava cozinhando. Para solucionar o problema, ela acrescentou batatas cruas e sem tempero dentro da panela. Quando terminou de cozinhá-lo, as batatas estavam salgadas, porque absorveram parte do caldo com excesso de sal. Finalmente, ela adicionou água para completar o caldo do feijão. O sal foi absorvido pelas batatas por","osmose, por envolver apenas o transporte do solvente.","fagocitose, porque o sal transportado é uma substância sólida.","exocitose, uma vez que o sal foi transportado da água para a batata.","pinocitose, porque o sal estava diluído na água quando foi transportado.","difusão, porque o transporte ocorreu a favor do gradiente de concentração.",2019,96,CN,E,portuguese
QUESTÃO 97,"A agricultura de precisão reúne técnicas agrícolas que consideram particularidades locais do solo ou lavoura a fim de otimizar o uso de recursos. Uma das formas de adquirir informações sobre essas particularidades é a fotografia aérea de baixa altitude realizada por um veículo aéreo não tripulado (vant). Na fase de aquisição  é importante determinar o nível de sobreposição entre as fotografias. A figura ilustra como uma sequência de imagens é coletada por um vant e como são formadas as sobreposições frontais. Descrição da imagem:  Ilustração de um vant com câmera fotográfica num voo horizontal. Há 3 triângulos retângulos parcialmente sobrepostos com ângulos agudos de 45 graus, cujos lados tracejados formam um ângulo de 90 graus, oposto à base e com um vant sobre cada um deles. Na parte inferior, há a indicação de 20 por cento de sobreposição frontal (medida da base de um triângulo formado pela sobreposição de dois triângulos). Abaixo dos triângulos há 3 quadrados sobrepostos (numerados de 1 a 3, da esquerda para a direita, e de mesma largura que a base dos triângulos retângulos). Entre os quadrados 1 e 2 e entre os quadrados 2 e 3 há uma área cinza que corresponde aos 20 por cento de sobreposição frontal. O operador do vant recebe uma encomenda na qual as imagens devem ter uma sobreposição frontal de  20 por cento em um terreno plano. Para realizar a aquisição das imagens, seleciona uma altitude H fixa de voo de 1 000 metros , a uma velocidade constante de 50 metros por segundo . A abertura da câmera fotográfica do vant é de 90 graus . Considere tangente de 45 graus igual a 1. Com que intervalo de tempo o operador deve adquirir duas imagens consecutivas?",40 segundos.,32 segundos.,28 segundos.,16 segundos.,8 segundos.,2019,97,CN,B,portuguese
QUESTÃO 98,"Uma das técnicas de reciclagem química do polímero PET [poli(tereftalato de etileno)] gera o tereftalato de metila e o etanodiol, conforme o esquema de reação, e ocorre por meio de uma reação de transesterificação. Descrição do esquema de reação: O polímero PET reage com 2 n do composto",", sob condições de altas temperaturas e pressão, formando dois produtos. O reagente PET é um polímero de n monômeros com a estrutura, entre colchetes, de um anel aromático com grupo CO ligado ao carbono 1 e COO ligado ao carbono 4. O oxigênio do grupo COO do carbono 4 faz ligação simples com o grupo CH 2 CH 2 O. Um dos produtos formado tem n moléculas de um composto que contém um anel aromático com grupos COOCH 3 ligados aos carbonos 1 e 4. O outro produto formado tem mais n moléculas do composto HOCH 2 CH 2 OH. O composto A , representado no esquema de reação, é o A metano.",metanol.,éter metílico.,ácido etanoico.,anidrido etanoico.,2019,98,CN,B,portuguese
QUESTÃO 99,"Durante sua evolução, as plantas apresentaram grande diversidade de características, as quais permitiram sua sobrevivência em diferentes ambientes. Na imagem, cinco dessas características estão indicadas por números. Descrição da imagem: A imagem representa um cladograma a partir de uma alga verde ancestral, destacando cinco aquisições evolutivas. Aquisição evolutiva 1 (embriões protegidos no gametófito, entre 500 e 450 milhões de anos): linha tracejada para Hepáticas, outra para Antóceros, outra para Musgos e uma linha contínua para aquisição evolutiva 2. Aquisição evolutiva 2 (tecidos condutores verdadeiros, entre 450 e 400 milhões de anos): linha contínua para Licófitas (licopódios, Isoetes e Selaginella ), linha contínua para Pteridófitas (samambaias, cavalinhas, Psilotum ) e outra linha contínua para aquisição evolutiva 3. Aquisição evolutiva 3 (formação de tubo polínico, próximo de 300 milhões de anos): linha contínua para aquisição evolutiva 4 (polinização pelo vento, próximo de 0 milhão de anos) — Gimnospermas; e para aquisição evolutiva 5 (produção de frutos, próximo de 0 milhão de anos) — Angiospermas. A aquisição evolutiva que permitiu a conquista definitiva do ambiente terrestre pelas plantas está indicada pelo número",1 : Embriões protegidos no gametófito .,2 : Tecidos condutores verdadeiros .,3 : Formação de tubo polínico .,4 : Polinização pelo vento .,5 : Produção de frutos .,2019,99,CN,C,portuguese
QUESTÃO 100,"Em 1962, um jingle (vinheta musical) criado por Heitor Carillo fez tanto sucesso que extrapolou as fronteiras do rádio e chegou à televisão ilustrado por um desenho animado. Nele, uma pessoa respondia ao fantasma que batia em sua porta, personificando o “frio”, que não o deixaria entrar, pois não abriria a porta e compraria lãs e cobertores para aquecer sua casa. Apesar de memorável, tal comercial televisivo continha incorreções a respeito de conceitos físicos relativos à calorimetria. Para solucionar essas incorreções, deve-se associar à porta e aos cobertores, respectivamente, as funções de:",Aquecer a casa e os corpos.,Evitar a entrada do frio na casa e nos corpos.,Minimizar a perda de calor pela casa e pelos corpos.,Diminuir a entrada do frio na casa e aquecer os corpos.,Aquecer a casa e reduzir a perda de calor pelos corpos.,2019,100,CN,C,portuguese
QUESTÃO 101,"Glicólise é um processo que ocorre nas células, convertendo glicose em piruvato. Durante a prática de exercícios físicos que demandam grande quantidade de esforço, a glicose é completamente oxidada na presença de O 2 . Entretanto, em alguns casos, as células musculares podem sofrer um déficit de O 2 e a glicose ser convertida em duas moléculas de ácido lático. As equações termoquímicas para a combustão da glicose e do ácido lático são, respectivamente, mostradas a seguir: Descrição das equações químicas: Os reagentes C 6 H 12 O 6 (sólido) mais 6 O 2 (gasoso) formam os produtos 6 CO 2 (gasoso) mais 6 H 2 O (líquido). Variação de entalpia de combustão igual a − 2 800 quilojoules. Os reagentes CH 3 CH(OH)COOH (sólido) mais 3 O 2  (gasoso) formam os produtos 3 CO 2 (gasoso) mais 3 H 2 O (líquido). Variação de entalpia de combustão igual a − 1 344 quilojoules. O processo anaeróbico é menos vantajoso energeticamente porque",libera 112 quilojoules por mol de glicose.,libera 467 quilojoules por mol de glicose.,libera 2 688 quilojoules por mol de glicose.,absorve 1 344 quilojoules por mol de glicose.,absorve 2 800 quilojoules por mol de glicose.,2019,101,CN,A,portuguese
QUESTÃO 102,No quadro estão apresentadas informações sobre duas estratégias de sobrevivência que podem ser adotadas por algumas espécies de seres vivos. Descrição do quadro: Quadro com estratégias 1 e 2. Estratégia 1: Hábitat: Mais instável e imprevisível. Potencial biótico: Muito elevado. Duração da vida: Curta e com reprodução precoce. Descendentes: Muitos e com tamanho corporal pequeno. Tamanho populacional: Variável.  Estratégia 2: Hábitat: Mais estável e previsível. Potencial biótico: Baixo. Duração da vida: Longa e com reprodução tardia. Descendentes: Poucos e com tamanho corporal maior. Tamanho populacional: Constante. Na recuperação de uma área desmatada deveriam ser reintroduzidas primeiramente as espécies que adotam qual estratégia?,"Estratégia 1, pois essas espécies produzem descendentes pequenos, o que diminui a competição com outras espécies.","Estratégia 2, pois essas espécies têm uma longa duração da vida, o que favorece a produção de muitos descendentes.","Estratégia 1, pois essas espécies apresentam um elevado potencial biótico, o que facilita a rápida recolonização da área desmatada.","Estratégia 2, pois essas espécies estão adaptadas a hábitats mais estáveis, o que corresponde ao ambiente de uma área desmatada.","Estratégia 2, pois essas espécies apresentam um tamanho populacional constante, o que propicia uma recolonização mais estáv el da área desmatada.",2019,102,CN,C,portuguese
QUESTÃO 103,"Uma casa tem um cabo elétrico mal dimensionado, de resistência igual a 10 ohms , que a conecta à rede elétrica de 120 volts . Nessa casa, cinco lâmpadas, de resistência igual a 200 ohms , estão conectadas ao mesmo circuito que uma televisão de resistência igual a 50 ohms , conforme ilustrado no esquema. A televisão funciona apenas com tensão entre 90 volts e 130 volts . Descrição do esquema: Circuito misto de malha externa retangular. No lado esquerdo do circuito há uma fonte de 120 volts e um resistor de 10 ohms. No lado direito do circuito há um resistor de 50 ohms. Internamente, há 5 lâmpadas, de 200 ohms cada, conectadas paralelamente à fonte por meio de interruptores individuais. O número máximo de lâmpadas que podem ser ligadas sem que a televisão pare de funcionar é:",1.,2.,3.,4.,5.,2019,103,CN,B,portuguese
QUESTÃO 104,"O 2,4-dinitrofenol (DNP) é conhecido como desacoplador da cadeia de elétrons na mitocôndria e apresenta um efeito emagrecedor. Contudo, por ser perigoso e pela ocorrência de casos letais, seu uso como medicamento é proibido em diversos países, inclusive no Brasil. Na mitocôndria, essa substância captura, no espaço intermembranas, prótons (H + ) provenientes da atividade das proteínas da cadeia respiratória, retornando-os à matriz mitocondrial.  Assim, esses prótons não passam pelo transporte enzimático na membrana interna. O efeito emagrecedor desse composto está relacionado ao(à)","obstrução da cadeia respiratória, resultando em maior consumo celular de ácidos graxos.","bloqueio das reações do ciclo de Krebs, resultando em maior gasto celular de energia.","diminuição da produção de acetil CoA, resultando em maior gasto celular de piruvato.","inibição da glicólise, resultando em maior absorção celular da glicose sanguínea.","redução da produção de ATP, resultando em maior gasto celular de nutrientes.",2019,104,CN,E,portuguese
QUESTÃO 105,"Em 1808, Dalton publicou o seu famoso livro intitulado Um novo sistema de filosofia química (do original A New System of Chemical Philosophy ), no qual continha os cinco postulados que serviam como alicerce da primeira teoria atômica da matéria fundamentada no método científico. Esses postulados são numerados a seguir: 1. A matéria é constituída de átomos indivisíveis. 2. Todos os átomos de um dado elemento químico são idênticos em massa e em todas as outras propriedades. 3. Diferentes elementos químicos têm diferentes tipos de átomos; em particular, seus átomos têm diferentes massas. 4. Os átomos são indestrutíveis e nas reações químicas mantêm suas identidades. 5. Átomos de elementos combinam com átomos de outros elementos em proporções de números inteiros pequenos para formar compostos. Após o modelo de Dalton, outros modelos baseados em outros dados experimentais evidenciaram, entre outras coisas, a natureza elétrica da matéria, a composição e organização do átomo e a quantização da energia no modelo atômico. Com base no modelo atual que descreve o átomo, qual dos postulados de Dalton ainda é considerado correto?",1,2,3,4,5,2019,105,CN,E,portuguese
QUESTÃO 106,"Numa feira de ciências, um estudante utilizará o disco de Maxwell (ioiô) para demonstrar o princípio da conservação da energia. A apresentação consistirá em duas etapas: Etapa 1 - a explicação de que, à medida que o disco desce, parte de sua energia potencial gravitacional é transformada em energia cinética de translação e energia cinética de rotação; Etapa 2 - o cálculo da energia cinética de rotação do disco no ponto mais baixo de sua trajetória, supondo o sistema conservativo. Ao preparar a segunda etapa, ele considera a aceleração da gravidade igual a 10 metros por segundo ao quadrado e a velocidade linear do centro de massa do disco desprezível em comparação com a velocidade angular. Em seguida, mede a altura do topo do disco em relação ao chão no ponto mais baixo de sua trajetória, obtendo um terço da altura da haste do brinquedo. As especificações de tamanho do brinquedo, isto é, de comprimento, largura e altura, assim como da massa de seu disco de metal, foram encontradas pelo estudante no recorte de manual ilustrado a seguir. Descrição do recorte de manual: Ilustração do disco de Maxwell (ioiô). Duas hastes verticais e paralelas, fixadas em um suporte (base). Essas hastes sustentam uma barra horizontal superior. Nessa barra estão fixados dois fios verticais e paralelos. Há uma barra menor (horizontal), que passa pelo centro de um disco, presa na outra extremidade dos fios. O disco está fixo na região central da barra menor. A distância do topo do disco até a barra superior é dois terços da altura da barra superior até a base. Abaixo da figura estão as seguintes especificações: • Conteúdo: base de metal, hastes metálicas, barra superior, disco de metal. • Tamanho: 300 milímetros de comprimento por 100 milímetros de largura por 410 milímetros de altura. • Massa do disco de metal: 30 gramas. O resultado do cálculo da etapa 2, em joule, é:","4,10 vezes, abre parêntese, 10 elevado a menos dois, fecha parêntese .","8,20 vezes, abre parêntese, 10 elevado a menos dois, fecha parêntese .","1,23 vezes, abre parêntese, 10 elevado a menos um, fecha parêntese .","8,20 vezes, abre parêntese, 10 elevado a quatro, fecha parêntese .","1,23 vezes, abre parêntese, 10 elevado a cinco, fecha parêntese .",2019,106,CN,B,portuguese
QUESTÃO 107,"O odor que permanece nas mãos após o contato com alho pode ser eliminado pela utilização de um “sabonete de aço inoxidável”, constituído de aço inox (74 por cento ), cromo e níquel. A principal vantagem desse “sabonete” é que ele não se desgasta com o uso. Considere que a principal substância responsável pelo odor de alho é a alicina (estrutura I) e que, para que o odor seja eliminado, ela seja transformada na estrutura II. Descrição das estruturas: Estrutura I: Estrutura contendo CH 2 ligação dupla CH ligação simples CH 2 ligação simples S ligação simples S (esse enxofre tem carga positiva e se liga, por meio de ligação simples, a um átomo de oxigênio que tem carga negativa) esse mesmo enxofre faz ligação simples CH 2 ligação simples CH ligação dupla CH 2 . Estrutura II: Estrutura contendo CH 2 ligação dupla CH ligação simples CH 2 ligação simples S ligação simples S ligação simples CH 2 ligação simples CH ligação dupla CH 2 . Na conversão de I em II, o “sabonete” atuará como um",ácido.,redutor.,eletrólito.,tensoativo.,catalisador.,2019,107,CN,E,portuguese
QUESTÃO 108,"A contaminação dos oceanos por  radionuclídeos antropogênicos A poluição radioativa compreende mais de  200 nuclídeos, sendo que, do ponto de vista de impacto ambiental, destacam-se o césio-137 e o estrôncio-90. A maior contribuição de radionuclídeos antropogênicos no meio marinho ocorreu durante as décadas de 1950 e 1960, como resultado dos testes nucleares realizados na atmosfera. O estrôncio-90 pode se acumular nos organismos vivos e em cadeias alimentares e, em razão de sua semelhança química, pode participar no equilíbrio com carbonato e substituir o cálcio em diversos processos biológicos. Ao entrar numa cadeia alimentar da qual o homem faz parte, em qual tecido do organismo humano o estrôncio-90 será acumulado predominantemente?",Cartilaginoso.,Sanguíneo.,Muscular.,Nervoso.,Ó s seo.,2019,108,CN,E,portuguese
QUESTÃO 109,Dois amigos se encontram em um posto de gasolina para calibrar os pneus de suas bicicletas.  Uma das bicicletas é de corrida (bicicleta,") e a outra, de passeio (bicicleta","). Os pneus de ambas as bicicletas têm as mesmas características, exceto que a largura dos pneus de A é menor que a largura dos pneus de B . Ao calibrarem os pneus das bicicletas A e B , respectivamente com pressões de calibração p A e p B , os amigos observam que o pneu da bicicleta A deforma, sob mesmos esforços, muito menos que o pneu da bicicleta B .  Pode-se considerar que as massas de ar comprimido no pneu da bicicleta A , m A , e no pneu da bicicleta B , m B , são diretamente proporcionais aos seus volumes. Comparando as pressões e massas de ar comprimido nos pneus das bicicletas, temos: A p A menor que  p B e m A menor que  m B B p A maior que  p B e m A menor que  m B",p A maior que  p B e m A igual a  m B,p A menor que  p B e m A igual a  m B,p A maior que  p B e m A maior que  m B,2019,109,CN,B,portuguese
QUESTÃO 110,"As usinas termelétricas podem utilizar carvão, gás natural ou óleo, que são queimados na câmara de combustão para gerar energia elétrica pela formação de vapor de água. A água utilizada no processo é captada de fontes naturais e volta para o ambiente. Para minimizar os efeitos da poluição, existe um sistema que retém as cinzas e parte dos gases produzidos, como NO x e SO x . As cinzas, quando geradas, podem ser utilizadas em misturas de cimento. O impacto ambiental desse tipo de geração de energia está relacionado com a",emissão de gases poluentes na atmosfera.,área inundada para o reservatório de água.,contaminação da água utilizada no processo.,quantidade de água consumida para gerar vapor.,produção de resíduos sólidos lançados no ambiente.,2019,110,CN,A,portuguese
QUESTÃO 111,"A eritropoetina (EPO) é um hormônio endógeno secretado pelos rins que influencia a maturação dos eritrócitos. Suas formas recombinantes, sintetizadas em laboratório, têm sido usadas por alguns atletas em esportes de resistência na busca por melhores resultados. No entanto, a administração da EPO recombinante no esporte foi proibida pelo Comitê Olímpico Internacional e seu uso considerado doping . Uma influência que esse doping poderá exercer na melhoria da capacidade física desses atletas está relacionada ao transporte de","lipídios, para aumento do gasto calórico.","ATP, para aumento da síntese hormonal.","oxigênio, para aumento da produção de ATP.","proteínas, para aumento da massa muscular.","vitamina C, para aumento da integridade  dos vasos sanguíneos.",2019,111,CN,C,portuguese
QUESTÃO 112,"O objetivo de recipientes isolantes térmicos é minimizar as trocas de calor com o ambiente externo. Essa troca de calor é proporcional à condutividade térmica k e à área interna das faces do recipiente, bem como à diferença de temperatura entre o ambiente externo e o interior do recipiente, além de ser inversamente proporcional à espessura das faces. A fim de avaliar a qualidade de dois recipientes",(40 centímetros por 40 centímetros por 40 centímetros ) e,"(60 centímetros por 40 centímetros por 40 centímetros ), de faces de mesma espessura, uma estudante compara suas condutividades térmicas k A e k B . Para isso suspende, dentro de cada recipiente, blocos idênticos de gelo a  0 grau Celsius , de modo que suas superfícies estejam em contato apenas com o ar. Após um intervalo de tempo, ela abre os recipientes enquanto ambos ainda contêm um pouco de gelo e verifica que a massa de gelo que se fundiu no recipiente B foi o dobro da que se fundiu no recipiente A . A razão k A k B é mais próxima de A 0,50. B 0,67.","0,75.","1,33.","2,00.",2019,112,CN,B,portuguese
