question,body,A,B,C,D,E,year,question_number,test,answer,language,CO_HABILIDADE,NU_PARAM_A,NU_PARAM_B,NU_PARAM_C,CO_PROVA
QUESTÃO 26,"Colonizar, afirmava, em 1912, um eminente jurista, “é relacionar-se com os países novos para tirar benefícios dos recursos de qualquer natureza desses países, aproveitá-los no interesse nacional, e ao mesmo tempo levar às populações primitivas as vantagens da cultura intelectual, social, científica, moral, artística, literária, comercial e industrial, apanágio das raças superiores. A colonização é, pois, um estabelecimento fundado em país novo por uma raça de civilização avançada, para realizar o duplo fim que acabamos de indicar”. A definição de colonização apresentada no texto tinha a função ideológica de",dissimular a prática da exploração mediante a ideia de civilização.,compensar o saque das riquezas mediante a educação formal dos colonos.,formar uma identidade colonial mediante a recuperação de sua ancestralidade.,reparar o atraso da Colônia mediante a incorporação dos hábitos da Metrópole.,promover a elevação cultural da Colônia mediante a incorporação de tradições metropolitanas.,2015,26,CH,A,portuguese,,2.08722,1.14525,0.191,273
QUESTÃO 27,"TEXTO I Não é possível passar das trevas da ignorância para a luz da ciência a não ser lendo, com um amor sempre mais vivo, as obras dos Antigos. Ladrem os cães, grunhem os porcos! Nem por isso deixarei de ser um seguidor dos Antigos. Para eles irão todos os meus cuidados e, todos os dias, a aurora me encontrará entregue ao seu estudo. TEXTO II A nossa geração tem arraigado o defeito de recusar admitir tudo o que parece vir dos modernos. Por isso, quando descubro uma ideia pessoal e quero torná-la pública, atribuo-a a outrem e declaro: — Foi fulano de tal que o disse, não sou eu. E para que acreditem totalmente nas minhas opiniões, digo: — O inventor foi fulano de tal, não sou eu. Nos textos são apresentados pontos de vista distintos sobre as mudanças culturais ocorridas no século XII no Ocidente. Comparando os textos, os autores discutem o(a)",produção do conhecimento face à manutenção dos argumentos de autoridade da Igreja.,caráter dinâmico do pensamento laico frente à estagnação dos estudos religiosos.,surgimento do pensamento científico em oposição à tradição teológica cristã.,desenvolvimento do racionalismo crítico ao opor fé e razão.,construção de um saber teológico científico.,2015,27,CH,A,portuguese,,1.87418,2.28638,0.14128,273
QUESTÃO 28,"Decreto-lei 3.509, de 12 de setembro de 1865 Art. 1º – O cidadão guarda-nacional que por si apresentar outra pessoa para o serviço do Exército por tempo de nove anos, com a idoneidade regulada pelas leis militares, ficará isento não só do recrutamento, senão também do serviço da Guarda Nacional. O substituído é responsável por o que o substituiu, no caso de deserção. No artigo, tem-se um dos mecanismos de formação dos “Voluntários da Pátria”, encaminhados para lutar na Guerra do Paraguai. Tal prática passou a ocorrer com muita frequência no Brasil nesse período e indica o(a)",forma como o Exército brasileiro se tornou o mais bem equipado da América do Sul.,incentivo dos grandes proprietários à participação dos seus filhos no conflito.,solução adotada pelo país para aumentar o contingente de escravos no conflito.,"envio de escravos para os conflitos armados, visando sua qualificação para o trabalho.",fato de que muitos escravos passaram a substituir seus proprietários em troca de liberdade.,2015,28,CH,E,portuguese,,1.20147,0.86974,0.21038,273
QUESTÃO 29,"Descrição da imagem: Uma charge mostra o dia amanhecendo. Um homem que segura uma lista do TRE e um mesário que segura uma urna estão abrindo a porta da Seção Eleitoral. Ao lado da porta, um eleitor está sentado em um banquinho com um rádio na mão e o seu título de eleitor. O primeiro homem pergunta ao eleitor: — ... E o senhor não cansou esperando a hora de votar pra presidente? O eleitor responde: — Não! Me distraí ouvindo as notícias: o assassinato do Kennedy, a guerra do Vietname, o surgimento dos Beatles, a chegada do homem na Lua, a invenção do transístor e do microcomputador, os conflitos do Oriente Médio, o surgimento da aids, a guerra das Malvinas, a Perestroika na Rússia, o fim do muro de Berlim... Ao lado do eleitor, riscos na parede revelam que o tempo de espera foi de 29 anos. O diálogo entre os personagens da charge evidencia, no Brasil, a(s)",reinserção do país na economia globalizada.,transformações políticas na vigência do Estado Novo.,alterações em áreas estratégicas para o desenvolvimento do país.,suspensão das eleições legislativas durante o período da Ditadura Militar.,volta da democracia após um período sem eleições diretas para o Executivo Federal.,2015,29,CH,E,portuguese,,2.42926,1.36834,0.24586,273
QUESTÃO 30,"Na obra A república , Platão escreve: Suponha homens numa morada subterrânea, em forma de caverna, cuja entrada, aberta à luz, se estende sobre todo o comprimento da fachada; eles estão lá desde a infância, as pernas e o pescoço presos por correntes, de tal sorte que não podem trocar de lugar e só podem olhar para frente, pois os grilhões os impedem de voltar a cabeça; a luz de uma fogueira acesa ao longe, numa elevada do terreno, brilha por detrás deles; entre a fogueira e os prisioneiros, há um caminho ascendente; ao longo do caminho, imagine um pequeno muro, semelhante aos tapumes que os manipuladores de marionetes armam entre eles e o público e sobre os quais exibem seus prestígios. Essa narrativa de Platão é uma importante manifestação cultural do pensamento grego antigo, cuja ideia central, do ponto de vista filosófico, evidencia o(a)","caráter antropológico, descrevendo as origens do homem primitivo.","sistema penal da época, criticando o sistema carcerário da sociedade ateniense.","vida cultural e artística, expressa por dramaturgos trágicos e cômicos gregos.","sistema político elitista, provindo do surgimento da pólis e da democracia ateniense.","teoria do conhecimento, expondo a passagem do mundo ilusório para o mundo das ideias.",2015,30,CH,E,portuguese,,1.79394,1.17944,0.17976,273
QUESTÃO 31,"No livro A natureza do bem , Agostinho escreve: Se os nossos adversários, que admitem a existência de uma natureza não criada por Deus, o Sumo Bem, quisessem admitir que essas considerações estão certas, deixariam de proferir tantas blasfêmias, como a de atribuir a Deus tanto a autoria dos bens quanto dos males. Pois sendo Ele fonte suprema da Bondade, nunca poderia ter criado aquilo que é contrário à sua natureza. Para Agostinho, não se deve atribuir a Deus a origem do mal porque",o surgimento do mal é anterior à existência de Deus.,"o mal, enquanto princípio ontológico, independe de Deus.","Deus apenas transforma a matéria, que é, por natureza, má.","por ser bom, Deus não pode criar o que lhe é oposto, o mal.",Deus se limita a administrar a dialética existente entre o bem e o mal.,2015,31,CH,D,portuguese,,3.1044,0.3689,0.194,273
QUESTÃO 32,"Em 1960, os 20% mais ricos da população mundial dispunham de um capital trinta vezes mais elevado do que o dos 20% mais pobres, o que já era escandaloso. Mas, ao invés de melhorar, a situação ainda se agravou. Hoje, o capital dos ricos em relação ao dos pobres é, não mais trinta, mas oitenta e duas vezes mais elevado. Que característica socioeconômica está expressa no texto?",Expansão demográfica.,Homogeneidade social.,Concentração de renda.,Desemprego conjuntural.,Desenvolvimento econômico.,2015,32,CH,C,portuguese,,5.08173,0.44019,0.17168,273
QUESTÃO 33,"Mediante o Código de Posturas de 1932, o poder público enumera e prevê, para os habitantes de Fortaleza, uma série de proibições condicionadas pela hora: após as 22 horas era vetada a emissão de sons em volume acentuado. O uso de buzinas, sirenes, vitrolas, motores ou qualquer objeto que produzisse barulho seria punido com multa. No início dos anos 1940 o último bonde partia da Praça do Ferreira às 23 horas. Como Fortaleza, muitas capitais brasileiras experimentaram, na primeira metade do século XX, um novo tipo de vida urbana, marcado por condutas que evidenciam uma",experiência temporal regida pelo tempo orgânico e pessoal.,experiência que flexibilizava a obediência ao tempo do relógio.,relação de códigos que estimulavam o trânsito de pessoas na cidade.,normatização do tempo com vistas à disciplina dos corpos na cidade.,cultura urbana capaz de conviver com diferentes experiências temporais.,2015,33,CH,D,portuguese,,1.73173,1.57142,0.17161,273
QUESTÃO 34,"Descrição da imagem: Há duas figuras. A primeira, em tamanho maior, informa que a distância real ( D ) entre duas residências é igual a 2 000 metros. A segunda, indicada pela palavra “Carta”, traz uma representação em escala reduzida dessa distância ( d ), igual a 40 milímetros. As figuras representam a distância real ( D ) entre duas residê ncias e a distância proporcional ( d ) em uma representanção cartográfica, as quais permitem estabelecer relações espaciais entre o mapa e o terreno. Para a ilustração apresentada, a escala numérica correta é",1/50.,1/5 000.,1/50 000.,1/80 000.,1/80 000 000.,2015,34,CH,C,portuguese,,2.98378,1.42877,0.16907,273
QUESTÃO 35,"Dubai é uma cidade-estado planejada para estarrecer os visitantes. São tamanhos e formatos grandiosos, em hotéis e centros comerciais reluzentes, numa colagem de estilos e atrações que parece testar diariamente os limites da arquitetura voltada para o lazer. O maior shopping do tórrido Oriente Médio abriga uma pista de esqui, a orla do Golfo Pérsico ganha milionárias ilhas artificiais, o centro financeiro anuncia para breve a torre mais alta do mundo (a Burj Dubai) e tem ainda o projeto de um campo de golfe coberto! Coberto e refrigerado, para usar com sol e chuva, inverno e verão. No texto, são descritas algumas características da paisagem de uma cidade do Oriente Médio. Essas características descritas são resultado do(a)",criação de territórios políticos estratégicos.,preocupação ambiental pautada em decisões governamentais.,utilização de tecnologia para transformação do espaço.,demanda advinda da extração local de combustíveis fósseis.,emprego de recursos públicos na redução de desigualdades sociais.,2015,35,CH,C,portuguese,,1.02285,0.76582,0.22642,273
QUESTÃO 36,"No livro Nordeste , Gilberto Freyre escreve: Sabe-se o que era a mata do Nordeste, antes da monocultura da cana: um arvoredo tanto e tamanho e tão basto e de tantas prumagens que não podia homem dar conta. O canavial desvirginou todo esse mato grosso do modo mais cru: pela queimada. A fogo é que foram se abrindo no mato virgem os claros por onde se estendeu o canavial civilizador, mas ao mesmo tempo devastador. Analisando os desdobramentos da atividade canavieira sobre o meio físico, o autor salienta um paradoxo, caracterizado pelo(a)","demanda de trabalho, que favorecia a escravidão.","modelo civilizatório, que acarretou danos ambientais.","rudimento das técnicas produtivas, que eram ineficientes.","natureza da atividade econômica, que concentrou riqueza.","predomínio da monocultura, que era voltada para exportação.",2015,36,CH,B,portuguese,,2.26979,0.47351,0.19982,273
QUESTÃO 37,"Na sociedade democrática, as opiniões de cada um não são fortalezas ou castelos para que neles nos encerremos como forma de autoafirmação pessoal. Não só temos de ser capazes de exercer a razão em nossas argumentações, como também devemos desenvolver a capacidade de ser convencidos pelas melhores razões. A partir dessa perspectiva, a verdade buscada é sempre um resultado , não ponto de partida: e essa busca inclui a conversação entre iguais, a polêmica, o debate, a controvérsia. A ideia de democracia presente no texto, baseada na concepção de Habermas acerca do discurso, defende que a verdade é um(a)","alvo objetivo alcançável por cada pessoa, como agente racional autônomo.","critério acima dos homens, de acordo com o qual podemos julgar quais opiniões são as melhores.","construção da atividade racional de comunicação entre os indivíduos, cujo resultado é um consenso.","produto da razão, que todo indivíduo traz latente desde o nascimento, mas que só se firma no processo educativo.","resultado que se encontra mais desenvolvido nos espíritos elevados, a quem cabe a tarefa de convencer os outros.",2015,37,CH,C,portuguese,,1.40999,0.87428,0.20289,273
QUESTÃO 38,"Descrição da imagem: Fotografia que mostra um grande número de pessoas segurando faixas de protesto. No primeiro plano, há uma grande faixa com os dizeres: Fora Collor! Impeachment já! Na imagem, encontram-se referências a um momento de intensa agitação estudantil no país. Tal mobilização se explica pela",divulgação de denúncias de corrupção envolvendo o presidente da República.,criminalização dos movimentos sociais realizada pelo Governo Federal.,adoção do arrocho salarial implementada pelo Ministério da Fazenda.,compra de apoio político promovida pelo Poder Executivo.,violência da repressão estatal atribuída às Forças Armadas.,2015,38,CH,A,portuguese,,1.55271,0.11942,0.19389,273
QUESTÃO 39,"O reconhecimento da união homoafetiva levou o debate à esfera pública, dividindo opiniões. Apesar da grande repercussão gerada pela mídia, a população ainda não se faz suficientemente esclarecida, confundindo o conceito de união estável com casamento. Apesar de ter sido legitimado pelo Supremo Tribunal Federal (STF), o reconhecimento da união homoafetiva é fruto do protagonismo dos movimentos sociais como um todo. As decisões em favor das minorias, tomadas pelo Poder Judiciário, foram possíveis pela organização desses grupos. Ainda que não sejam assimiladas por toda a população, essas mudanças",contribuem para a manutenção da ordem social.,reconhecem a legitimidade desses pleitos.,dependem da iniciativa do Poder Legislativo Federal.,resultam na celebração de um consenso político.,excedem o princípio da iso nomia jurídica.,2015,39,CH,B,portuguese,,2.17772,1.61528,0.17107,273
QUESTÃO 40,"Em 1881, a Câmara dos Deputados aprovou uma reforma na lei eleitoral brasileira, a fim de introduzir o voto direto. A grande novidade, porém, ficou por conta da exigência de que os eleitores soubessem ler e escrever. As consequências logo se refletiram nas estatísticas. Em 1872, havia mais de 1 milhão de votantes, já em 1886, pouco mais de 100 mil cidadãos participaram das eleições parlamentares. Houve um corte de quase 90 por cento do eleitorado. Nas últimas décadas do século XIX, o Império do Brasil passou por transformações como as descritas, que representaram a",ascensão dos “homens bons”.,restrição dos direitos políticos.,superação dos currais eleitorais.,afirmação do eleitorado monarquista.,ampliação da representação popular.,2015,40,CH,B,portuguese,,1.61671,1.63073,0.22094,273
QUESTÃO 41,"Em 1943, Getúlio Vargas criou o Departamento de Propaganda e Difusão Cultural junto ao Ministério da Justiça, esvaziando o Ministério da Educação não só da propaganda, mas também do rádio e do cinema. A decisão tinha como objetivo colocar os meios de comunicação de massa a serviço direto do Poder Executivo, iniciativa que tinha inspiração direta no recém-criado Ministério da Propaganda alemão. No contexto citado, a transferência de funções entre ministérios teve como finalidade o(a)",desativação de um sistema tradicional de comunicação voltado para a educação.,controle do conteúdo da informação por meio de uma orientação política e ideológica.,subordinação do Ministério da Educação ao Ministério da Justiça e ao Poder Executivo.,ampliação do raio de atuação das emissoras de rádio como forma de difusão da cultura popular.,demonstração de força política do Executivo diante de ministérios herdados do governo anterior.,2015,41,CH,B,portuguese,,2.43926,0.43916,0.20033,273
QUESTÃO 42,"A população negra teve que enfrentar sozinha o desafio da ascensão social, e frequentemente procurou fazê-lo por rotas originais, como o esporte, a música e a dança. Esporte, sobretudo o futebol, música, sobretudo o samba, e dança, sobretudo o carnaval, foram os principais canais de ascensão social dos negros até recentemente. A libertação dos escravos não trouxe consigo a igualdade efetiva. Essa igualdade era afirmada nas leis, mas negada na prática. Ainda hoje, apesar das leis, aos privilégios e arrogâncias de poucos correspondem o desfavorecimento e a humilhação de muitos. Em relação ao argumento de que no Brasil existe uma democracia racial, o autor demonstra que",essa ideologia equipara a nação a outros países modernos.,esse modelo de democracia foi possibilitado pela miscigenação.,essa peculiaridade nacional garantiu mobilidade social aos negros.,esse mito camuflou formas de exclusão em relação aos afrodescendentes.,essa dinâmica política depende da participação ativa de todas as etnias.,2015,42,CH,D,portuguese,,3.35048,0.84549,0.17939,273
QUESTÃO 43,"TEXTO I Os problemas ambientais são consequência direta da intervenção humana nos diferentes ecossistemas da Terra, causando desequilíbrios no meio ambiente e comprometendo a qualidade de vida. TEXTO II Descrição da imagem: Três imagens representam as geleiras da Groenlândia e mostram o impacto dos problemas ambientais. A primeira imagem é do ano de 1992 e mostra que ocorreu um impacto pequeno nas extremidades da geleira. A segunda imagem é do ano de 2002 e mostra que o impacto ambiental aumentou nas extremidades da geleira e que começa a avançar para o centro. A terceira imagem, do ano de 2005, mostra que o impacto ambiental aumentou, comprometendo toda a parte inferior da geleira e a extremidade superior esquerda. As imagens representam as geleiras da Groenlândia, que sofreram e sofrem impactos, resultantes do(a)",ilha de calor.,chuva ácida.,erosão eólica.,inversão térmica.,aquecimento global.,2015,43,CH,E,portuguese,,1.50768,-0.97123,0.20262,273
QUESTÃO 44,"A crescente conscientização sobre os efeitos do modelo intensivo de produção, adotado de forma geral na agricultura, tem gerado também uma série de reações. De fato, a agricultura está cada vez mais pressionada pelo conjunto de relações que mantém com a sociedade em geral, sendo emergente o que comumente se denomina “questão ambiental”. Essas relações, às vezes de dependência, às vezes de conflito, são as que determinam uma chamada ampla para mudanças orientadas à sustentabilidade, não só da atividade agrícola em si, senão que afete de maneira geral a todo o entorno no qual a agricultura está inserida. No texto, faz-se referência a um tipo de pressão da sociedade contemporânea sobre a agricultura. Essa pressão objetiva a seguinte transformação na atividade agrícola:",Ampliação de políticas de financiamento voltadas para a produção de transgênicos.,Modernização do modo de produção focado na alta produtividade da terra.,Expansão do agronegócio relacionado ao mercado consumidor externo.,Promoção de práticas destinadas à conservação de recursos naturais.,Inserção de modelos orientados ao uso intensivo de agroquímicos.,2015,44,CH,D,portuguese,,2.20567,0.68027,0.20512,273
QUESTÃO 45,"Uma dimensão da flexibilização do tempo de trabalho é a sutileza cada vez maior das fronteiras que separam o espaço de trabalho e o do lar, o tempo de trabalho e o de não trabalho. Os mecanismos modernos de comunicação permitem que, no horário de descanso, os trabalhadores permaneçam ligados à empresa. Mesmo não exercendo diretamente suas atividades profissionais, o trabalhador fica à disposição da empresa ou leva problemas para refletir em casa. É muito comum o trabalhador estar de plantão, para o caso de a empresa ligar para o seu celular ou pager . A remuneração para esse estado de alerta é irrisória ou inexistente. A relação entre mudanças tecnológicas e tempo de trabalho apresentada pelo texto implica o",prolongamento da jornada de trabalho com a intensificação da exploração.,aumento da fragmentação da produção com a racionalização do trabalho.,privilégio de funcionários familiarizados com equipamentos eletrônicos.,crescimento da contratação de mão de obra pouco qualificada.,declínio dos salários pagos aos empregados mais idosos.  ,2015,45,CH,A,portuguese,,3.04414,0.29816,0.19909,273
