question,body,A,B,C,D,E,year,question_number,test,answer,language
QUESTÃO 73,"A participação social no planejamento e na gestão
urbanos ganhou impulso a partir do Estatuto da
Cidade (Lei número 10.257/2001), que estabeleceu
condições para elaboração de planos diretores
participativos, instrumentos esses indutores da
expansão urbana e do ordenamento territorial
que, a Princípio, devem buscar representar os
interesses dos diversos segmentos da sociedade.
No entanto, é notório o limite à representação dos
interesses das camadas sociais menos favorecidas
nesse processo. Este rumo deve ser corrigido e deve-
se continuar buscando mecanismos de inclusão dos
interesses de toda a sociedade.

Qual medida promove a participação social descrita no
texto?",Redução dos impostos municipais.,Privatização dos espaços públicos.,Adensamento das áreas de comércio.,Valorização dos condomínios fechados.,Fortalecimento das associações de bairro.,2021,73,CH,E,portuguese
QUESTÃO 74,"Quando Getúlio Vargas se suicidou, em agosto de
1954, o país parecia à beira do caos. Acuado por uma
grave crise política, o velho líder preferiu uma bala no
peito à humilhação de aceitar uma nova deposição,
como a que sofrera em outubro de 1945. Entretanto, ao
contrário do que imaginavam os inimigos, ao ruído do
estampido não se seguiu o silêncio que cerca a derrota.
O evento analisado no texto teve como repercussão
imediata na política nacional a",reação popular.,intervenção militar.,abertura democrática.,campanha anticomunista.,radicalização oposicionista.,2021,74,CH,A,portuguese
QUESTÃO 75,"História dos ciganos no Brasil

Eu, Dom João, pela graça de Deus, faço saber a
Vossa Mercê que me aprouve banir para essa cidade
vários ciganos — homens, mulheres e crianças — devido
ao seu escandaloso procedimento neste reino. Tiveram
ordem de seguir em diversos navios destinados a esse
porto, e, tendo eu proibido, por lei recente, o uso da
sua língua habitual, ordeno a Vossa Mercê que cumpra
essa lei sob ameaça de penalidades, não permitindo que
ensinem dita língua a seus filhos, de maneira que daqui
por diante o seu uso desapareça.

A ordem emanada da Coroa portuguesa para sua colônia
americana, em 1718, apresentava um tratamento da
identidade cultural pautado em",converter grupos infiéis à religião oficial.,suprimir formas divergentes de interação social.,evitar envolvimento estrangeiro na economia local.,reprimir indivíduos engajados em revoltas nativistas.,"controlar manifestações artísticas de comunidades
autóctones.",2021,75,CH,B,portuguese
QUESTÃO 76,"Refugiados no Brasil: reflexões acerca do processo
de integração local

A categoria de refugiado carrega em si as noções
de transitoriedade, provisoriedade e temporalidade.
Os refugiados situam-se entre o país de origem e o
país de destino. Ao transitarem entre os dois universos,
ocupam posição marginal, tanto em termos identitários
— assentada na falta de pertencimento pleno enquanto
membros da comunidade receptora e nos vínculos
introjetados por códigos partilhados com a comunidade
de origem — quanto em termos jurídicos, ao deixarem
de exercitar, ao menos em caráter temporário, o status
de cidadãos no país de origem e portar o status de
refugiados no país receptor.

A condição de transitoriedade dos refugiados no Brasil,
conforme abordada no texto, é provocada pela associação",ascensão social e burocracia estatal.,miscigenação étnica e limites fronteiriços.,desqualificação profissional e ação policial.,instabilidade financeira e crises econômicas.,desenraizamento cultural e insegurança legal.,2021,76,CH,E,portuguese
QUESTÃO 77,"Mulheres naturalistas raramente figuraram na corrida
por conhecer terras exóticas. No século dezenove,
mulheres como Lady Charlotte Canning eventualmente
coletavam espécimes botânicos, mas quase sempre no
papel de esposas coloniais, viajando para locais onde
seus maridos as levavam e não em busca de seus
próprios projetos científicos.

No contexto do século dezenove, a relação das mulheres
com o campo científico, descrita no texto, é representativa
da",afirmação da igualdade de gênero.,transformação dos espaços de lazer.,superação do pensamento patriarcal.,incorporação das estratificações sociais.,substituição das atividades domésticas.,2021,77,CH,D,portuguese
QUESTÃO 78,"A ideologia da sociedade industrial: o homem
unidimensional, Herbert Marcuse

Nos setores mais altamente desenvolvidos da
sociedade contemporânea, o transplante de necessidades
sociais para individuais é de tal modo eficaz que a diferença
entre elas parece puramente teórica. As criaturas se
reconhecem em suas mercadorias; encontram sua alma
em seu automóvel, casa em patamares, utensílios de
cozinha.

O texto indica que, no capitalismo, a satisfação dos
desejos pessoais é influenciada por",políticas estatais de divulgação.,incentivos controlados de consumo.,prescrições coletivas de organização.,mecanismos subjetivos de identificação.,repressões racionalizadas do narcisismo.,2021,78,CH,D,portuguese
QUESTÃO 79,"A vida das pessoas se modifica com a mesma rapidez
com que se reproduz a cidade. O lugar da festa, do
encontro quase desaparecem; o número de brincadeiras
infantis nas ruas diminui — as crianças quase não são
vistas; os pedaços da cidade são vendidos, no mercado,
como mercadorias; árvores são destruídas, praças
transformadas em concreto. Por outro lado, os habitantes
parecem perder na cidade suas próprias referências.
A imagem de uma grande cidade hoje é tão mutante
que se assemelha à de um grande guindaste, aliás, a
presença maciça destes, das britadeiras, das betoneiras
nos dão o limite do processo de transformação diária ao
qual está submetida a cidade.

No contexto das grandes cidades brasileiras, a situação
apresentada no texto vem ocorrendo como consequência
da",manutenção dos modos de convívio social.,preservação da essência do espaço público.,ampliação das normas de controle ambiental.,flexibilização das regras de participação política.,alteração da organização da paisagem geográfica.,2021,79,CH,E,portuguese
QUESTÃO 80,"No semiárido brasileiro, o sertanejo desenvolveu uma
acuidade detalhada para a observação dos fenômenos,
ao longo dos tempos, presenciados na natureza, em
especial para a previsão do tempo e do clima, utilizando
como referência a posição dos astros, constelação
e nuvens. Conforme os sertanejos, a estação vai
ser chuvosa quando a primeira lua cheia de janeiro
“sair vermelha, por detrás de uma barra de nuvens”, mas
“se surgir prateada, é sinal de seca”.

O texto expõe a produção de um conhecimento que se
constitui pela",técnica científica.,experiência perceptiva.,negação das tradições.,padronização das culturas.,uniformização das informações.,2021,80,CH,B,portuguese
QUESTÃO 81,"Admirável gado novo, Zé Ramalho

Vocês que fazem parte dessa massa
Que passa nos projetos do futuro
É duro tanto ter que caminhar
E dar muito mais do que receber
É, Ô, Ô, vida de gado
Povo marcado
É, povo feliz!
Qual comportamento coletivo é criticado no trecho da
letra da canção lançada em 1979?",Militância política.,Passividade social.,Altruísmo religioso.,Autocontrole moral.,Inconformismo eleitoral.,2021,81,CH,B,portuguese
QUESTÃO 82,"TEXTO 1

Em 2016, foram gerados 44,7 milhões de toneladas
de resíduos eletrônicos, um aumento de 8 por cento
na comparação com 2014. Especialistas previram um
crescimento de mais 17 por cento, para 52,2 milhões de
toneladas, até 2021.
TEXTO 2

Há ainda quem exporte deliberadamente lixo
eletrônico para o Gana. É mais caro reciclar devidamente
os resíduos no mundo industrializado, onde até existem
os recursos e a tecnologia. Um negócio muito mais
lucrativo é vender o lixo eletrônico a negociantes locais,
que o importam alegando tratar-se de material usado.
Os negociantes depois vendem o lixo aos jovens no
mercado, ou noutro lado, que o desmantelam e extraem os
fios de cobre. Estes são derretidos em lareiras ao ar livre,
poluindo o ar e, muitas vezes, intoxicando diretamente os
próprios jovens.

No contexto das discussões ambientais, as práticas
descritas nos textos refletem um padrão de relações
derivado do(a):",Exercício pleno da cidadania.,Divisão internacional do trabalho.,Gestão empresarial do toyotismo.,Concepção sustentável da economia.,Protecionismo alfandegário dos Estados.,2021,82,CH,B,portuguese
QUESTÃO 83,"Relatório Mundial das Nações Unidas sobre
Desenvolvimento dos Recursos Hídricos

Preços justos e autorizações de uso da água devem
garantir de forma adequada que a retirada de água, bem
como o retorno de efluentes, mantenham operações
eficientes e ambientalmente sustentáveis, de maneira
que sejam adaptáveis às peculiaridades e necessidades
da indústria e da irrigação em larga escala, bem como
às atividades da agricultura em pequena escala e de
subsistência.

Considerando o debate sobre segurança hídrica, a
proposta apresentada no texto está pautada no(a)",distribuição equitativa do abastecimento.,monitoramento do fornecimento urbano.,racionamento da capacidade fluvial.,revitalização gradativa de solos.,geração de produtos recicláveis.,2021,83,CH,A,portuguese
QUESTÃO 84,"A abolição do comércio brasileiro de escravos

Durante os anos de 1854-55, o governo brasileiro —
por meio de sua representação diplomática em Londres
— e os livre-cambistas ingleses — nas colunas do
Daily News e na Câmara dos Comuns — aumentaram
a pressão pela revogação da Lei Aberdeen. O governo
britânico, entretanto, ainda receava que, sem um tratado
anglo-brasileiro satisfatório para substituí-la, não haveria
nada que impedisse os brasileiros de um dia voltarem aos
seus velhos hábitos.

As tensões diplomáticas expressas no texto indicam o
interesse britânico em",estabelecer jurisdição conciliadora.,compartilhar negócios marítimos.,fomentar políticas higienistas.,manter a proibição comercial.,promover o negócio familiar.,2021,84,CH,D,portuguese
QUESTÃO 85,"Famoso por ser o encantador de viúvas da cidade
de Cabaceiras, na Paraíba, Zé de Sila é um contador de
histórias parecido com o personagem Chicó, do Auto da
Compadecida. Ele defende veementemente que a oração
da avó sustentava mais a chuva. “Quando era pequeno e
chovia por aqui, ajudava minha avó colocando os pratos
emborcados no terreiro para diminuir o vento. Ela fazia
isso e rezava para a chuva durar mais”, diz Zé de Sila.

Ao destacar expressões e vivências populares do
cotidiano, o texto mobiliza os seguintes aspectos da
diversidade regional:",Alianças afetivas conectadas ao ritual matrimonial.,Práticas místicas associadas ao patrimônio cultural.,Manifestações teatrais atreladas ao imaginário político.,"Narrativas fílmicas relacionadas às intempéries
climáticas.","Argumentações literárias interligadas às catástrofes
ambientais.",2021,85,CH,B,portuguese
QUESTÃO 86,"Novas tecnologias nos processos de trabalho:
efeitos da reestruturação produtiva


O uso de novas tecnologias envolve a assimilação
de uma cultura empresarial na qual haja a integração
entre as propostas de modernização tecnológica e a
racionalização. Nem sempre o uso de novas tecnologias
é apenas um processo técnico na medida em que
pressupõe uma nova orientação no controle do capital,
no processo produtivo e na qualificação da mão de obra.
Dos diversos efeitos que derivaram dessa orientação, a
terceirização, a precarização e a flexibilização aparecem
com constância como características do paradigma
flexível, em substituição ao modelo taylorista-fordista.

O uso de novas tecnologias relacionado ao controle
empresarial é criticado no texto em razão da",operacionalização da tarefa laboral.,capacitação de profissionais liberais.,fragilização das relações de trabalho.,hierarquização dos cargos executivos.,aplicação dos conhecimentos da ciência.,2021,86,CH,C,portuguese
QUESTÃO 87,"A simples vontade de checar mensagens do
trabalho pós-expediente prejudica sua
saúde — e a de sua família

Seu turno de trabalho acabou, você já está em casa e
é hora do jantar da família. Mas, em vez de relaxar, você
começa a pensar na possibilidade de ter recebido alguma
mensagem importante no e-mail profissional ou no grupo
de WhaisApp da empresa. Imediatamente, você fica
distante. Momentos depois, com alguns toques na tela
do celular, você está de volta ao ambiente de trabalho.
O jantar e a família ficaram em segundo plano.

O texto indica práticas nas relações cotidianas do trabalho
que causam para o indivíduo a",proteção da vida privada.,ampliação de atividades extras.,elevação de etapas burocráticas.,diversificação do lazer recreativo.,desobrigação de afazeres domésticos.,2021,87,CH,B,portuguese
QUESTÃO 88,"O capital no século vinte e um, Thomas Piketty

Quando a taxa de remuneração do capital excede
substancialmente a taxa de crescimento da economia,
pela lógica, a riqueza herdada aumenta mais rápido do
que a renda e a produção. Então, basta aos herdeiros
poupar uma parte limitada da renda de seu capital para
que ele cresça mais rápido do que a economia como
um todo. Sob essas condições, é quase inevitável que
a riqueza herdada supere a riqueza constituída durante
uma vida de trabalho, e que a concentração do capital
atinja níveis muito altos.

Considerando os princípios que legittmam as
democracias liberais, a lógica econômica descrita no
texto enfraquece o(a)",ideologia do mérito.,direito de nascimento.,eficácia da legislação.,ganho das financeiras.,eficiência dos mercados.,2021,88,CH,A,portuguese
QUESTÃO 89,"Programa de Melhoramento Genético “Uvas do Brasil”

Atualmente, o Programa de Melhoramento “Uvas
do Brasil” utiliza métodos clássicos de melhoramento,
como seleção massal, seleção clonal e hibridações.
Ações de ajuste de manejo de seleções avançadas
vêm sendo desenvolvidas paralelamente ao Programa
de Melhoramento, no sentido de viabilização desses
materiais. Ao longo dos seus 40 anos, uma grande equipe
técnica trabalhou para executar projetos de pesquisa para
atender às necessidades e às demandas de diferentes
atores da vitivinicultura nacional, incluindo produtores de
uvas de mesa para exportação do semiárido nordestino,
viticultores interessados em produzir sucos em regiões
tropicais ou pequenos produtores familiares da região da
Serra Gaúcha, interessados em melhorar a qualidade do
vinho artesanal que produzem.

Para melhorar a produção agrícola nas regiões
mencionadas, as técnicas referidas no texto buscaram
adaptar o cultivo aos(as)",espécies nativas ameaçadas.,cadeias econômicas autônomas.,estruturas fundiárias tradicionais.,elementos ambientais singulares.,mercados consumidores internos.,2021,89,CH,D,portuguese
QUESTÃO 90,"TEXTO 1
Carta de Veneza, 31 de maio de 1964

Portadoras de mensagem espiritual do passado, as
obras monumentais de cada povo perduram no presente
como o testemunho vivo de suas tradições seculares.
A humanidade, cada vez mais consciente da unidade
dos valores humanos, as considera um bem comum e,
perante as gerações futuras, se reconhece solidariamente
responsável por preservá-las, impondo a si mesma o
dever de transmiti-las na plenitude de sua autenticidade.

TEXTO 2
Manual do patrimônio histórico

Os sistemas tradicionais de proteção se mostram
cada vez menos eficientes diante do processo acelerado
de urbanização e transformação de nossa sociedade.
A legislação de proteção peca por considerar o
monumento, até certo ponto, desvinculado da realidade
socioeconômica. O tombamento, ao decretar a
imutabilidade do monumento, provoca a redução de seu
valor venal e o abandono, o que é uma causa, ainda que
lenta, de destruição inevitável.

Escritos em temporalidade histórica aproximada, os
textos se distanciam ao apresentarem pontos de vista
diferentes sobre a(s)", ampliação do comércio de imagens sacras.,substituição de materiais de valor artístico.,políticas de conservação de bens culturais.,defesa da privatização de sítios arqueológicos.,medidas de salvaguarda de peças museológicas.,2021,90,CH,C,portuguese
