question,body,A,B,C,D,E
QUESTÃO 27,"TEXTO I Não é possível passar das trevas da ignorância para a luz da ciência a não ser lendo, com um amor sempre mais vivo, as obras dos Antigos. Ladrem os cães, grunhem os porcos! Nem por isso deixarei de ser um seguidor dos Antigos. Para eles irão todos os meus cuidados e, todos os dias, a aurora me encontrará entregue ao seu estudo. TEXTO II A nossa geração tem arraigado o defeito de recusar admitir tudo o que parece vir dos modernos. Por isso, quando descubro uma ideia pessoal e quero torná-la pública, atribuo-a a outrem e declaro: — Foi fulano de tal que o disse, não sou eu. E para que acreditem totalmente nas minhas opiniões, digo: — O inventor foi fulano de tal, não sou eu. Nos textos são apresentados pontos de vista distintos sobre as mudanças culturais ocorridas no século XII no Ocidente. Comparando os textos, os autores discutem o(a)",produção do conhecimento face à manutenção dos argumentos de autoridade da Igreja.,caráter dinâmico do pensamento laico frente à estagnação dos estudos religiosos.,surgimento do pensamento científico em oposição à tradição teológica cristã.,desenvolvimento do racionalismo crítico ao opor fé e razão.,construção de um saber teológico científico.  CH - 1º dia | Caderno 11 - BRANCO - Página 10 2015
QUESTÃO 28,"Decreto-lei 3.509, de 12 de setembro de 1865 Art. 1º – O cidadão guarda-nacional que por si apresentar outra pessoa para o serviço do Exército por tempo de nove anos, com a idoneidade regulada pelas leis militares, ficará isento não só do recrutamento, senão também do serviço da Guarda Nacional. O substituído é responsável por o que o substituiu, no caso de deserção. No artigo, tem-se um dos mecanismos de formação dos “Voluntários da Pátria”, encaminhados para lutar na Guerra do Paraguai. Tal prática passou a ocorrer com muita frequência no Brasil nesse período e indica o(a)",forma como o Exército brasileiro se tornou o mais bem equipado da América do Sul.,incentivo dos grandes proprietários à participação dos seus filhos no conflito.,solução adotada pelo país para aumentar o contingente de escravos no conflito.,"envio de escravos para os conflitos armados, visando sua qualificação para o trabalho.",fato de que muitos escravos passaram a substituir seus proprietários em troca de liberdade.
QUESTÃO 29,"Descrição da imagem: Uma charge mostra o dia amanhecendo. Um homem que segura uma lista do TRE e um mesário que segura uma urna estão abrindo a porta da Seção Eleitoral. Ao lado da porta, um eleitor está sentado em um banquinho com um rádio na mão e o seu título de eleitor. O primeiro homem pergunta ao eleitor: — ... E o senhor não cansou esperando a hora de votar pra presidente? O eleitor responde: — Não! Me distraí ouvindo as notícias: o assassinato do Kennedy, a guerra do Vietname, o surgimento dos Beatles, a chegada do homem na Lua, a invenção do transístor e do microcomputador, os conflitos do Oriente Médio, o surgimento da aids, a guerra das Malvinas, a Perestroika na Rússia, o fim do muro de Berlim... Ao lado do eleitor, riscos na parede revelam que o tempo de espera foi de 29 anos. O diálogo entre os personagens da charge evidencia, no Brasil, a(s)",reinserção do país na economia globalizada.,transformações políticas na vigência do Estado Novo.,alterações em áreas estratégicas para o desenvolvimento do país.,suspensão das eleições legislativas durante o período da Ditadura Militar.,volta da democracia após um período sem eleições diretas para o Executivo Federal.  CH - 1º dia | Caderno 11 - BRANCO - Página 11 2015
QUESTÃO 30,"Na obra A república , Platão escreve: Suponha homens numa morada subterrânea, em forma de caverna, cuja entrada, aberta à luz, se estende sobre todo o comprimento da fachada; eles estão lá desde a infância, as pernas e o pescoço presos por correntes, de tal sorte que não podem trocar de lugar e só podem olhar para frente, pois os grilhões os impedem de voltar a cabeça; a luz de uma fogueira acesa ao longe, numa elevada do terreno, brilha por detrás deles; entre a fogueira e os prisioneiros, há um caminho ascendente; ao longo do caminho, imagine um pequeno muro, semelhante aos tapumes que os manipuladores de marionetes armam entre eles e o público e sobre os quais exibem seus prestígios. Essa narrativa de Platão é uma importante manifestação cultural do pensamento grego antigo, cuja ideia central, do ponto de vista filosófico, evidencia o(a)","caráter antropológico, descrevendo as origens do homem primitivo.","sistema penal da época, criticando o sistema carcerário da sociedade ateniense.","vida cultural e artística, expressa por dramaturgos trágicos e cômicos gregos.","sistema político elitista, provindo do surgimento da pólis e da democracia ateniense.","teoria do conhecimento, expondo a passagem do mundo ilusório para o mundo das ideias."
QUESTÃO 31,"No livro A natureza do bem , Agostinho escreve: Se os nossos adversários, que admitem a existência de uma natureza não criada por Deus, o Sumo Bem, quisessem admitir que essas considerações estão certas, deixariam de proferir tantas blasfêmias, como a de atribuir a Deus tanto a autoria dos bens quanto dos males. Pois sendo Ele fonte suprema da Bondade, nunca poderia ter criado aquilo que é contrário à sua natureza. Para Agostinho, não se deve atribuir a Deus a origem do mal porque",o surgimento do mal é anterior à existência de Deus.,"o mal, enquanto princípio ontológico, independe de Deus.","Deus apenas transforma a matéria, que é, por natureza, má.","por ser bom, Deus não pode criar o que lhe é oposto, o mal.",Deus se limita a administrar a dialética existente entre o bem e o mal.
QUESTÃO 32,"Em 1960, os 20% mais ricos da população mundial dispunham de um capital trinta vezes mais elevado do que o dos 20% mais pobres, o que já era escandaloso. Mas, ao invés de melhorar, a situação ainda se agravou. Hoje, o capital dos ricos em relação ao dos pobres é, não mais trinta, mas oitenta e duas vezes mais elevado. Que característica socioeconômica está expressa no texto?",Expansão demográfica.,Homogeneidade social.,Concentração de renda.,Desemprego conjuntural.,Desenvolvimento econômico.
QUESTÃO 33,"Mediante o Código de Posturas de 1932, o poder público enumera e prevê, para os habitantes de Fortaleza, uma série de proibições condicionadas pela hora: após as 22 horas era vetada a emissão de sons em volume acentuado. O uso de buzinas, sirenes, vitrolas, motores ou qualquer objeto que produzisse barulho seria punido com multa. No início dos anos 1940 o último bonde partia da Praça do Ferreira às 23 horas. Como Fortaleza, muitas capitais brasileiras experimentaram, na primeira metade do século XX, um novo tipo de vida urbana, marcado por condutas que evidenciam uma",experiência temporal regida pelo tempo orgânico e pessoal.,experiência que flexibilizava a obediência ao tempo do relógio.,relação de códigos que estimulavam o trânsito de pessoas na cidade.,normatização do tempo com vistas à disciplina dos corpos na cidade.,cultura urbana capaz de conviver com diferentes experiências temporais.  CH - 1º dia | Caderno 11 - BRANCO - Página 12 2015
QUESTÃO 34,"Descrição da imagem: Há duas figuras. A primeira, em tamanho maior, informa que a distância real ( D ) entre duas residências é igual a 2 000 metros. A segunda, indicada pela palavra “Carta”, traz uma representação em escala reduzida dessa distância ( d ), igual a 40 milímetros. As figuras representam a distância real ( D ) entre duas residê ncias e a distância proporcional ( d ) em uma representanção cartográfica, as quais permitem estabelecer relações espaciais entre o mapa e o terreno. Para a ilustração apresentada, a escala numérica correta é",1/50.,1/5 000.,1/50 000.,1/80 000.,1/80 000 000.
QUESTÃO 35,"Dubai é uma cidade-estado planejada para estarrecer os visitantes. São tamanhos e formatos grandiosos, em hotéis e centros comerciais reluzentes, numa colagem de estilos e atrações que parece testar diariamente os limites da arquitetura voltada para o lazer. O maior shopping do tórrido Oriente Médio abriga uma pista de esqui, a orla do Golfo Pérsico ganha milionárias ilhas artificiais, o centro financeiro anuncia para breve a torre mais alta do mundo (a Burj Dubai) e tem ainda o projeto de um campo de golfe coberto! Coberto e refrigerado, para usar com sol e chuva, inverno e verão. No texto, são descritas algumas características da paisagem de uma cidade do Oriente Médio. Essas características descritas são resultado do(a)",criação de territórios políticos estratégicos.,preocupação ambiental pautada em decisões governamentais.,utilização de tecnologia para transformação do espaço.,demanda advinda da extração local de combustíveis fósseis.,emprego de recursos públicos na redução de desigualdades sociais.  CH - 1º dia | Caderno 11 - BRANCO - Página 13 2015
QUESTÃO 36,"No livro Nordeste , Gilberto Freyre escreve: Sabe-se o que era a mata do Nordeste, antes da monocultura da cana: um arvoredo tanto e tamanho e tão basto e de tantas prumagens que não podia homem dar conta. O canavial desvirginou todo esse mato grosso do modo mais cru: pela queimada. A fogo é que foram se abrindo no mato virgem os claros por onde se estendeu o canavial civilizador, mas ao mesmo tempo devastador. Analisando os desdobramentos da atividade canavieira sobre o meio físico, o autor salienta um paradoxo, caracterizado pelo(a)","demanda de trabalho, que favorecia a escravidão.","modelo civilizatório, que acarretou danos ambientais.","rudimento das técnicas produtivas, que eram ineficientes.","natureza da atividade econômica, que concentrou riqueza.","predomínio da monocultura, que era voltada para exportação."
QUESTÃO 37,"Na sociedade democrática, as opiniões de cada um não são fortalezas ou castelos para que neles nos encerremos como forma de autoafirmação pessoal. Não só temos de ser capazes de exercer a razão em nossas argumentações, como também devemos desenvolver a capacidade de ser convencidos pelas melhores razões. A partir dessa perspectiva, a verdade buscada é sempre um resultado , não ponto de partida: e essa busca inclui a conversação entre iguais, a polêmica, o debate, a controvérsia. A ideia de democracia presente no texto, baseada na concepção de Habermas acerca do discurso, defende que a verdade é um(a)","alvo objetivo alcançável por cada pessoa, como agente racional autônomo.","critério acima dos homens, de acordo com o qual podemos julgar quais opiniões são as melhores.","construção da atividade racional de comunicação entre os indivíduos, cujo resultado é um consenso.","produto da razão, que todo indivíduo traz latente desde o nascimento, mas que só se firma no processo educativo.","resultado que se encontra mais desenvolvido nos espíritos elevados, a quem cabe a tarefa de convencer os outros."
QUESTÃO 38,"Descrição da imagem: Fotografia que mostra um grande número de pessoas segurando faixas de protesto. No primeiro plano, há uma grande faixa com os dizeres: Fora Collor! Impeachment já! Na imagem, encontram-se referências a um momento de intensa agitação estudantil no país. Tal mobilização se explica pela",divulgação de denúncias de corrupção envolvendo o presidente da República.,criminalização dos movimentos sociais realizada pelo Governo Federal.,adoção do arrocho salarial implementada pelo Ministério da Fazenda.,compra de apoio político promovida pelo Poder Executivo.,violência da repressão estatal atribuída às Forças Armadas.
QUESTÃO 39,"O reconhecimento da união homoafetiva levou o debate à esfera pública, dividindo opiniões. Apesar da grande repercussão gerada pela mídia, a população ainda não se faz suficientemente esclarecida, confundindo o conceito de união estável com casamento. Apesar de ter sido legitimado pelo Supremo Tribunal Federal (STF), o reconhecimento da união homoafetiva é fruto do protagonismo dos movimentos sociais como um todo. As decisões em favor das minorias, tomadas pelo Poder Judiciário, foram possíveis pela organização desses grupos. Ainda que não sejam assimiladas por toda a população, essas mudanças",contribuem para a manutenção da ordem social.,reconhecem a legitimidade desses pleitos.,dependem da iniciativa do Poder Legislativo Federal.,resultam na celebração de um consenso político.,excedem o princípio da iso nomia jurídica.  CH - 1º dia | Caderno 11 - BRANCO - Página 14 2015
QUESTÃO 40,"Em 1881, a Câmara dos Deputados aprovou uma reforma na lei eleitoral brasileira, a fim de introduzir o voto direto. A grande novidade, porém, ficou por conta da exigência de que os eleitores soubessem ler e escrever. As consequências logo se refletiram nas estatísticas. Em 1872, havia mais de 1 milhão de votantes, já em 1886, pouco mais de 100 mil cidadãos participaram das eleições parlamentares. Houve um corte de quase 90 por cento do eleitorado. Nas últimas décadas do século XIX, o Império do Brasil passou por transformações como as descritas, que representaram a",ascensão dos “homens bons”.,restrição dos direitos políticos.,superação dos currais eleitorais.,afirmação do eleitorado monarquista.,ampliação da representação popular.
QUESTÃO 41,"Em 1943, Getúlio Vargas criou o Departamento de Propaganda e Difusão Cultural junto ao Ministério da Justiça, esvaziando o Ministério da Educação não só da propaganda, mas também do rádio e do cinema. A decisão tinha como objetivo colocar os meios de comunicação de massa a serviço direto do Poder Executivo, iniciativa que tinha inspiração direta no recém-criado Ministério da Propaganda alemão. No contexto citado, a transferência de funções entre ministérios teve como finalidade o(a)",desativação de um sistema tradicional de comunicação voltado para a educação.,controle do conteúdo da informação por meio de uma orientação política e ideológica.,subordinação do Ministério da Educação ao Ministério da Justiça e ao Poder Executivo.,ampliação do raio de atuação das emissoras de rádio como forma de difusão da cultura popular.,demonstração de força política do Executivo diante de ministérios herdados do governo anterior.
QUESTÃO 42,"A população negra teve que enfrentar sozinha o desafio da ascensão social, e frequentemente procurou fazê-lo por rotas originais, como o esporte, a música e a dança. Esporte, sobretudo o futebol, música, sobretudo o samba, e dança, sobretudo o carnaval, foram os principais canais de ascensão social dos negros até recentemente. A libertação dos escravos não trouxe consigo a igualdade efetiva. Essa igualdade era afirmada nas leis, mas negada na prática. Ainda hoje, apesar das leis, aos privilégios e arrogâncias de poucos correspondem o desfavorecimento e a humilhação de muitos. Em relação ao argumento de que no Brasil existe uma democracia racial, o autor demonstra que",essa ideologia equipara a nação a outros países modernos.,esse modelo de democracia foi possibilitado pela miscigenação.,essa peculiaridade nacional garantiu mobilidade social aos negros.,esse mito camuflou formas de exclusão em relação aos afrodescendentes.,essa dinâmica política depende da participação ativa de todas as etnias.  CH - 1º dia | Caderno 11 - BRANCO - Página 15 2015
QUESTÃO 43,"TEXTO I Os problemas ambientais são consequência direta da intervenção humana nos diferentes ecossistemas da Terra, causando desequilíbrios no meio ambiente e comprometendo a qualidade de vida. TEXTO II Descrição da imagem: Três imagens representam as geleiras da Groenlândia e mostram o impacto dos problemas ambientais. A primeira imagem é do ano de 1992 e mostra que ocorreu um impacto pequeno nas extremidades da geleira. A segunda imagem é do ano de 2002 e mostra que o impacto ambiental aumentou nas extremidades da geleira e que começa a avançar para o centro. A terceira imagem, do ano de 2005, mostra que o impacto ambiental aumentou, comprometendo toda a parte inferior da geleira e a extremidade superior esquerda. As imagens representam as geleiras da Groenlândia, que sofreram e sofrem impactos, resultantes do(a)",ilha de calor.,chuva ácida.,erosão eólica.,inversão térmica.,aquecimento global.
QUESTÃO 44,"A crescente conscientização sobre os efeitos do modelo intensivo de produção, adotado de forma geral na agricultura, tem gerado também uma série de reações. De fato, a agricultura está cada vez mais pressionada pelo conjunto de relações que mantém com a sociedade em geral, sendo emergente o que comumente se denomina “questão ambiental”. Essas relações, às vezes de dependência, às vezes de conflito, são as que determinam uma chamada ampla para mudanças orientadas à sustentabilidade, não só da atividade agrícola em si, senão que afete de maneira geral a todo o entorno no qual a agricultura está inserida. No texto, faz-se referência a um tipo de pressão da sociedade contemporânea sobre a agricultura. Essa pressão objetiva a seguinte transformação na atividade agrícola:",Ampliação de políticas de financiamento voltadas para a produção de transgênicos.,Modernização do modo de produção focado na alta produtividade da terra.,Expansão do agronegócio relacionado ao mercado consumidor externo.,Promoção de práticas destinadas à conservação de recursos naturais.,Inserção de modelos orientados ao uso intensivo de agroquímicos.
QUESTÃO 45,"Uma dimensão da flexibilização do tempo de trabalho é a sutileza cada vez maior das fronteiras que separam o espaço de trabalho e o do lar, o tempo de trabalho e o de não trabalho. Os mecanismos modernos de comunicação permitem que, no horário de descanso, os trabalhadores permaneçam ligados à empresa. Mesmo não exercendo diretamente suas atividades profissionais, o trabalhador fica à disposição da empresa ou leva problemas para refletir em casa. É muito comum o trabalhador estar de plantão, para o caso de a empresa ligar para o seu celular ou pager . A remuneração para esse estado de alerta é irrisória ou inexistente. A relação entre mudanças tecnológicas e tempo de trabalho apresentada pelo texto implica o",prolongamento da jornada de trabalho com a intensificação da exploração.,aumento da fragmentação da produção com a racionalização do trabalho.,privilégio de funcionários familiarizados com equipamentos eletrônicos.,crescimento da contratação de mão de obra pouco qualificada.,declínio dos salários pagos aos empregados mais idosos.  CN - 1º dia | Caderno 11 - BRANCO - Página 16 2015
QUESTÃO 46,"Na natureza a matéria é constantemente transformada por meio dos ciclos biogeoquímicos. Além do ciclo da água, existem os ciclos do carbono, do enxofre, do fósforo, do nitrogênio e do oxigênio. O elemento que está presente em todos os ciclos nomeados é o",fósforo.,enxofre.,carbono.,oxigênio.,nitrogênio.
QUESTÃO 47,"Bioindicador ou indicador biológico é uma espécie ou grupo de espécies que reflete o estado biótico ou abiótico de um meio ambiente, o impacto produzido sobre um hábitat, comunidade ou ecossistema, entre outras funções. A posição trófica do organismo bioindicador é uma das características mais relevantes quanto ao seu grau de importância para essa função: quanto mais baixo o nível trófico do organismo, maior é a sua utilidade, pois pressupõe-se que toda a cadeia trófica é contaminada a partir dele. O grupo de organismos mais adequado para essa condição, do ponto de vista da sua posição na cadeia trófica, é constituído por",algas.,peixes.,baleias.,camarões.,anêmonas.
QUESTÃO 48,"Durante uma aula experimental de física, os estudantes construíram um sistema ressonante com pêndulos simples. As características de cada pêndulo são apresentadas no quadro. Inicialmente, os estudantes colocaram apenas o pêndulo A para oscilar. Descrição da imagem: Quadro apresenta três colunas: na primeira coluna, estão representados os pêndulos a serem estudados. Na segunda coluna, suas respectivas massas. E na terceira coluna, os comprimentos do barbante. O pêndulo A tem mass a M e comprimento L. O pêndulo 1 tem massa M e comprimento L.O pêndulo 2 tem massa M sobre 2 e comprimento 2 L.O pêndulo 3 tem massa 2 M e comprimento L sobre 2. O pêndulo 4 tem massa M sobre 2 e comprimento L sobre 2. O pêndulo 5 tem massa de 2 M e comprimento L. Quais pêndulos, além desse, passaram também a oscilar?","1, 2, 3, 4 e 5.","1, 2 e 3.",1 e 4.,1 e 5.,3 e 4.
QUESTÃO 49,"Descrição da imagem: Esquema que representa um ciclo no qual as moléculas de C6H12O6 e de CO2 estão relacionadas por processos identificados pelas setas 1 e 2. A seta de número 1 parte da molécula de C6H12O6 e chega à molécula de CO2. Já a seta de número 2, parte da molécula de CO2 e chega à molécula de C6H12O6. No esquema representado, o processo identificado pelo número 2 é realizado por",seres herbívoros.,fungos fermentadores.,bactérias heterótrofas.,organismos produtores.,microrganismos decompositores. CN - 1º dia | Caderno 11 - BRANCO - Página 17 2015
QUESTÃO 50,"Para irrigar sua plantação, um produtor rural construiu um reservatório a 20 metros de altura a partir da barragem de onde será bombeada a água. Para alimentar o motor elétrico das bombas, ele instalou um painel fotovoltaico. A potência do painel varia de acordo com a incidência solar, chegando a um valor de pico de 80 watts ao meio-dia. Porém, entre as 11 horas e 30 minutos e as 12 horas e 30 minutos, disponibiliza uma potência média de 50 watts. Considere a aceleração da gravidade igual a 10 metros por segundo ao quadrado e uma eficiência de transferência energética de 100 por cento. Qual é o volume de água, em litros, bombeado para o reservatório no intervalo de tempo citado?",150,250,450,900,1 440
QUESTÃO 51,"A fotografia feita sob luz polarizada é usada por dermatologistas para diagnósticos. Isso permite ver detalhes da superfície da pele que não são visíveis com o reflexo da luz branca comum. Para se obter luz polarizada, pode-se utilizar a luz transmitida por um polaroide ou a luz refletida por uma superfície na condição de Brewster, como mostra a figura. Nessa situação, o feixe da luz refratada forma um ângulo de 90 graus com o feixe da luz refletida, fenômeno conhecido como Lei de Brewster. Nesse caso, o ângulo de incidência teta p, também chamado de ângulo de polarização, e o ângulo de refração teta r estão em conformidade com a Lei de Snell. Descrição da imagem: Esquema que apresenta um raio de luz não polarizado incidindo sobre a superfície de uma lâmina com um ângulo de incidência teta p. Parte do raio sofre reflexão e torna-se totalmente polarizado. O ângulo de reflexão é idêntico ao ângulo de incidência. A outra parte do raio sofre refração e torna-se parcialmente polarizado. O ângulo de refração é igual a teta r. Dado: Seno de 30 graus igual a cosseno de 60 graus igual a um meio. Seno de 60 graus igual a cosseno de 30 graus igual a abre parêntese raiz de 3 fecha parêntese sobre 2. Considere um feixe de luz não polarizada proveniente de um meio com índice de refração igual a 1, que incide sobre uma lâmina e faz um ângulo de refração teta r de 30 graus. Nessa situação, qual deve ser o índice de refração da lâmina para que o feixe refletido seja polarizado?",Raiz de 3,Abre parêntese raiz de 3 fecha parêntese sobre 3,2,Um meio,Abre parêntese raiz de 3 fecha parêntese sobre 2  CN - 1º dia | Caderno 11 - BRANCO - Página 18 2015
QUESTÃO 52,"A toxina botulínica (produzida pelo bacilo Clostridium botulinum ) pode ser encontrada em alimentos malconservados, causando até a morte de consumidores. No entanto, essa toxina modificada em laboratório está sendo usada cada vez mais para melhorar a qualidade de vida das pessoas com problemas físicos e/ou estéticos, atenuando problemas como o blefaroespasmo, que provoca contrações involuntárias das pálpebras. O alívio dos sintomas do blefaroespasmo é consequência da ação da toxina modificada sobre o tecido","glandular, uma vez que ela impede a produção de secreção de substâncias na pele.","muscular, uma vez que ela provoca a paralisia das fibras que formam esse tecido.","epitelial, uma vez que ela leva ao aumento da camada de queratina que protege a pele.","conjuntivo, uma vez que ela aumenta a quantidade de substância intercelular no tecido.","adiposo, uma vez que ela reduz a espessura da camada de células de gordura do tecido."
QUESTÃO 53,"A cafeína é um alcaloide, identificado como 1,3,7-trimetilxantina (massa molar igual a 194 gramas por mol), cuja estrutura química contém uma unidade de purina, conforme representado. Esse alcaloide é encontrado em grande quantidade nas sementes de café e nas folhas de chá-verde. Uma xícara de café contém, em média, 80 miligramas de cafeína. Considerando que a xícara descrita contém um volume de 200 mililitros de café, a concentração, em mol por litro, de cafeína nessa xícara é mais próxima de:","0,0004.","0,002.","0,4.",2.,4.
QUESTÃO 54,"A reprodução vegetativa de plantas por meio de estacas é um processo natural. O homem, observando esse processo, desenvolveu uma técnica para propagar plantas em escala comercial. A base genética dessa técnica é semelhante àquela presente no(a)",transgenia.,clonagem.,hibridização.,controle biológico.,melhoramento genético.
