question,body,A,B,C,D,E
QUESTÃO 145,"Em 2014 foi inaugurada a maior roda-gigante do mundo, a High Roller , situada em Las Vegas. A figura representa um esboço dessa roda-gigante, no qual o ponto","representa uma de suas cadeiras: Descrição da figura: A figura representa um círculo dividido em doze raios. O centro está marcado com a letra O e a extremidade de um raio horizontal à direita está com a letra A, que representa uma cadeira. Um segmento perpendicular vai do centro do círculo até o solo. Uma seta indica que o movimento é anti-horário. A partir da posição indicada, em que o segmento OA  se encontra paralelo ao plano do solo, rotaciona-se a High Roller no sentido anti-horário, em torno do ponto O . Sejam t o ângulo determinado pelo segmento OA em relação à sua posição inicial, e f a função que descreve a altura do ponto A , em relação ao solo, em função de t . Após duas voltas completas, f tem o seguinte gráfico: A expressão da função altura é dada por A f de t é igual a 80 vezes seno de t mais 88.",f de t é igual a 80 vezes cosseno de t mais 88.,f de t é igual a 88 vezes cosseno de t mais 168.,f de t é igual a 168 vezes seno de t mais 88 vezes cosseno de t .,"f de t é igual a 88 vezes seno de t mais 168 vezes cosseno de t . Descrição do gráfico: No eixo horizontal, que representa tempo em radianos, estão marcados os pontos zero, pi sobre dois, dois pi e quatro pi. No eixo vertical, que representa f em metro, estão marcados os pontos 0, 88 e 168. Uma curva começa no ponto (0 ; 88) e sobe até o ponto (pi sobre 2 ; 168); a partir desse ponto, desce até perto do eixo horizontal e sobe passando pelo ponto (2pi ; 88), sobe até o ponto de ordenada 168, desce até perto do eixo horizontal e sobe até o ponto (4pi ; 88)."
QUESTÃO 146,"Os compositores Pedro, Ricardo e Carlos gravaram um disco com 18 músicas inéditas. Pedro participou da composição de seis músicas, Ricardo participou da composição de oito músicas e Carlos compôs sozinho o restante das músicas. Além disso, Carlos foi parceiro em um terço das músicas compostas por Pedro e em metade das músicas compostas por Ricardo. O número racional que expressa a participação de Carlos na composição das músicas desse disco é",fração de numerador 5 e denominador 9.,fração de numerador 5 e denominador 7.,fração de numerador 1 e denominador 3.,fração de numerador 2 e denominador 7.,fração de numerador 2 e denominador 9.
QUESTÃO 147,"De acordo com um relatório recente da Agência Internacional de Energia (AIE), o mercado de veículos elétricos atingiu um novo marco em 2016, quando foram vendidos mais de 750 mil automóveis da categoria. Com isso, o total de carros elétricos vendidos no mundo alcançou a marca de 2 milhões de unidades desde que os primeiros modelos começaram a ser comercializados em 2011. No Brasil, a expansão das vendas também se verifica. A marca A, por exemplo, expandiu suas vendas no ano de 2016, superando em 360 unidades as vendas de 2015, conforme representado no gráfico. A média anual do número de carros vendidos pela marca A, nos anos representados no gráfico, foi de",192.,240.,252.,320.,420.
QUESTÃO 148,"Para apagar os focos A e B de um incêndio, que estavam a uma distância de 30 metros um do outro, os bombeiros de um quartel decidiram se posicionar de modo que a distância de um bombeiro ao foco A, de temperatura mais elevada, fosse sempre o dobro da distância desse bombeiro ao foco B, de temperatura menos elevada. Nestas condições, a maior distância, em metro, que dois bombeiros poderiam ter entre eles é",30.,40.,45.,60.,68.
QUESTÃO 149,"Torneios de tênis, em geral, são disputados em sistema de eliminatória simples. Nesse sistema, são disputadas partidas entre dois competidores, com a eliminação do perdedor e promoção do vencedor para a fase seguinte. Dessa forma, se na primeira fase o torneio conta com 2 n competidores, então na segunda fase restarão n competidores, e assim sucessivamente até a partida final. Em um torneio de tênis, disputado nesse sistema, participam 128 tenistas. Para se definir o campeão desse torneio, o número de partidas necessárias é dado por",2 × 128,64 + 32 + 16 + 8 + 4 + 2,128 + 64 + 32 + 16 + 8 + 4 + 2 + 1,128 + 64 + 32 + 16 + 8 + 4 + 2,64 + 32 + 16 + 8 + 4 + 2 + 1
QUESTÃO 150,"O artigo 33 da lei brasileira sobre drogas prevê a pena de reclusão de 5 a 15 anos para qualquer pessoa que seja condenada por tráfico ilícito ou produção não autorizada de drogas. Entretanto, caso o condenado seja réu primário, com bons antecedentes criminais, essa pena pode sofrer uma redução de um sexto a dois terços. Suponha que um réu primário, com bons antecedentes criminais, foi condenado pelo artigo 33 da lei brasileira sobre drogas. Após o benefício da redução de pena, sua pena poderá variar de",1 ano e 8 meses a 12 anos e 6 meses.,1 ano e 8 meses a 5 anos.,3 anos e 4 meses a 10 anos.,4 anos e 2 meses a 5 anos.,"4 anos e 2 meses a 12 anos e 6 meses. Descrição do gráfico: O eixo horizontal representa o número de carros e o eixo vertical, o ano. 2014: desenho de um carro. 2015: desenho de dois carros.2016: desenho de cinco carros."
