question,body,A,B,C,D,E
QUESTÃO 91,"Para serem absorvidos pelas células do intestino humano, os lipídios ingeridos precisam ser primeiramente emulsificados. Nessa etapa da digestão, torna-se necessária a ação dos ácidos biliares, visto que os lipídios apresentam uma natureza apolar e são insolúveis em água. Esses ácidos atuam no processo de modo a",hidrolisar os lipídios.,agir como detergentes.,tornar os lipídios anfifílicos.,promover a secreção de lipases.,estimular o trânsito intestinal dos lipídios.
QUESTÃO 92,"A tecnologia de comunicação da etiqueta RFID (chamada de etiqueta inteligente) é usada há anos para rastrear gado, vagões de trem, bagagem aérea e carros nos pedágios. Um modelo mais barato dessas etiquetas pode funcionar sem baterias e é constituído por três componentes: um microprocessador de silício; uma bobina de metal, feita de cobre ou de alumínio, que é enrolada em um padrão circular; e um encapsulador, que é um material de vidro ou polímero envolvendo o microprocessador e a bobina. Na presença de um campo de radiofrequência gerado pelo leitor, a etiqueta transmite sinais. A distância de leitura é determinada pelo tamanho da bobina e pela potência da onda de rádio emitida pelo leitor. A etiqueta funciona sem pilhas porque o campo",elétrico da onda de rádio agita elétrons da bobina.,elétrico da onda de rádio cria uma tensão na bobina.,magnético da onda de rádio induz corrente na bobina.,magnético da onda de rádio aquece os fios da bobina.,magnético da onda de rádio diminui a ressonância no interior da bobina.
QUESTÃO 93,"Corredores ecológicos visam mitigar os efeitos da fragmentação dos ecossistemas promovendo a ligação entre diferentes áreas, com o objetivo de proporcionar o deslocamento de animais, a dispersão de sementes e o aumento da cobertura vegetal. São instituídos com base em informações como estudos sobre o deslocamento de espécies, sua área de vida (área necessária para o suprimento de suas necessidades vitais e reprodutivas) e a distribuição de suas populações. Nessa estratégia, a recuperação da biodiversidade é efetiva porque",propicia o fluxo gênico.,intensifica o manejo de espécies.,amplia o processo de ocupação humana.,aumenta o número de indivíduos nas populações.,favorece a formação de ilhas de proteção integral.
QUESTÃO 94,"A identificação de riscos de produtos perigosos para o transporte rodoviário é obrigatória e realizada por meio da sinalização composta por um painel de segurança, de cor alaranjada, e um rótulo de risco. As informações inseridas no painel de segurança e no rótulo de risco, conforme determina a legislação, permitem que se identifique o produto transportado e os perigos a ele associados. A sinalização mostrada identifica uma substância que está sendo transportada em um caminhão. Descrição da sinalização: Painel contendo dois números. Na parte superior está o número 268; na parte inferior, o número 1005. Do lado direito há um losango com a ilustração de um crânio humano com dois ossos cruzados e a informação textual: “Gás tóxico 2”. Os três algarismos da parte superior do painel indicam o “Número de risco”. O número 268 indica tratar-se de um gás (2), tóxico (6) e corrosivo (8). Os quatro dígitos da parte inferior correspondem ao “Número ONU”, que identifica o produto transportado. Considerando a identificação apresentada no caminhão, o código 1005 corresponde à substância",eteno (C 2 H4).,nitrogênio (N 2 ).,amônia (NH3).,propano (C3H8).,dióxido de c arbono (CO 2 ).
QUESTÃO 95,"Fundamentos da biologia celular No ciclo celular atuam moléculas reguladoras. Dentre elas, a proteína p53 é ativada em resposta a mutações no DNA, evitando a progressão do ciclo até que os danos sejam reparados, ou induzindo a célula à autodestruição. A ausência dessa proteína poderá favorecer a","redução da síntese de DNA, acelerando o ciclo celular.","saída imediata do ciclo celular, antecipando a proteção do DNA.","ativação de outras proteínas reguladoras, induzindo a apoptose.","manutenção da estabilidade genética, favorecendo a longevidade.","proliferação celular exagerada, resultando na formação de um tumor."
QUESTÃO 96,"Estratificação aquática é o fenômeno de divisão dos lagos em camadas com diferentes temperaturas.  No verão a água mais próxima à superfície é aquecida pelo sol, formando uma camada quente, e a camada inferior do lago se mantém mais fria. No inverno a camada superior esfria, ocorrendo um processo de troca de nutrientes e oxigênio entre as camadas. Esse processo ocorre devido ao(à)",diminuição da taxa de evaporação da água.,aproximação da temperatura entre as camadas.,diminuição da temperatura das camadas inferiores.,aumento da taxa de condensação da umidade do ar.,aumento da densidade da água da camada superior.
QUESTÃO 97,"O grafeno é uma forma alotrópica do carbono constituído por uma folha planar (arranjo bidimensional) de átomos de carbono compactados e com a espessura de apenas um átomo. Sua estrutura é hexagonal, conforme a figura. Nesse arranjo, os átomos de carbono possuem hibridação",sp de geometria linear.,sp dois de geometria trigonal planar.,sp três alternados com carbonos com hibridação sp de geometria linear.,sp três d de geometria planar.,sp três d  dois com geometria hexagonal planar.
QUESTÃO 98,"Um projetista deseja construir um brinquedo que lance um pequeno cubo ao longo de um trilho horizontal, e o dispositivo precisa oferecer a opção de mudar a velocidade de lançamento. Para isso, ele utiliza uma mola e um trilho onde o atrito pode ser desprezado, conforme a figura. Descrição da figura: A figura ilustra o brinquedo como um tubo (trilho horizontal) com a extremidade esquerda fechada e a direita aberta. Uma mola está dentro do tubo, fixada na extremidade fechada e sendo comprimida por um cubo, que se pretende lançar pela parte aberta. Para que a velocidade de lançamento do cubo seja aumentada quatro vezes, o projetista deve",manter a mesma mola e aumentar duas vezes a sua deformação.,manter a mesma mola e aumentar quatro vezes a sua deformação.,manter a mesma mola e aumentar dezesseis vezes a sua deformação.,trocar a mola por outra de constante elástica duas vezes maior e manter a deformação.,"trocar a mola por outra de constante elástica quatro vezes maior e manter a defo rmação. Descrição da estrutura do grafeno: A estrutura apresenta uma rede plana formada por vários hexágonos interligados, que contêm, em cada vértice, um átomo de carbono. Cada átomo de carbono está ligado a outros três átomos de carbono presentes nos vértices desses hexágonos."
QUESTÃO 99,"A liberação de gases poluentes para a atmosfera, provenientes da decomposição do lixo orgânico nos aterros sanitários, tornou-se um grande problema para o meio ambiente. Uma das alternativas para minimizá-lo é o aproveitamento desses gases para gerar energias elétrica e térmica. O gás produzido em grande quantidade utilizado para o propósito mencionado é o",H 2 S.,CH4.,N 2 O.,NO 2 .,SO3.
QUESTÃO 100,"O carro flex é uma realidade no Brasil. Estes veículos estão equipados com motor que tem a capacidade de funcionar com mais de um tipo de combustível. No entanto, as pessoas que têm esse tipo de veículo, na hora do abastecimento, têm sempre a dúvida: álcool ou gasolina? Para avaliar o consumo desses combustíveis, realizou-se um percurso com um veículo flex, consumindo 40 litros de gasolina e no percurso de volta utilizou-se etanol.  Foi considerado o mesmo consumo de energia tanto no percurso de ida quanto no de volta. O quadro resume alguns dados aproximados sobre esses combustíveis. O volume de etanol combustível, em litro, consumido no percurso de volta é mais próximo de",27.,32.,37.,58.,67.
QUESTÃO 101,"As abelhas utilizam a sinalização química para distinguir a abelha-rainha de uma operária, sendo capazes de reconhecer diferenças entre moléculas. A rainha produz o sinalizador químico conhecido como ácido 9-hidroxidec-2-enoico, enquanto as abelhas- -operárias produzem ácido 10-hidroxidec-2-enoico.  Nós podemos distinguir as abelhas-operárias e rainhas por sua aparência, mas, entre si, elas usam essa sinalização química para perceber a diferença. Pode-se dizer que veem por meio da química. As moléculas dos sinalizadores químicos produzidas pelas abelhas rainha e operária possuem diferença na",fórmula estrutural.,fórmula molecular.,identificação dos tipos de ligação.,contagem do número de carbonos.,"identificação dos grupos funcionais. Descrição do quadro: Quadro com dois combustíveis e seus valores de densidade em grama por mililitro e calor de combustão em quilocaloria por grama. Etanol: densidade: 0,8  calor de combustão: − 6 Gasolina: densidade: 0,7 calor de combustão: − 10"
QUESTÃO 102,"Insetos podem apre sentar três tipos de desenvolvimento. Um deles, a holometabolia (desenvolvimento completo), é constituído pelas fases de ovo, larva, pupa e adulto sexualmente maduro, que ocupam diversos hábitats. Os insetos com holometabolia pertencem às ordens mais numerosas em termos de espécies conhecidas. Esse tipo de desenvolvimento está relacionado a um maior número de espécies em razão da","proteção na fase de pupa, favorecendo a sobrevivência de adultos férteis.","produção de muitos ovos, larvas e pupas, aumentando o número de adultos.","exploração de diferentes nichos, evitando a competição entre as fases da vida.","ingestão de alimentos em todas as fases de vida, garantindo o surgimento do adulto.","utilização do mesmo alimento em todas as fases, otimizando a nutrição do organismo."
QUESTÃO 103,"Talvez você já tenha bebido suco usando dois canudinhos iguais. Entretanto, pode-se verificar que, se colocar um canudo imerso no suco e outro do lado de fora do líquido, fazendo a sucção simultaneamente em ambos, você terá dificuldade em bebê-lo. Essa dificuldade ocorre porque o(a)",força necessária para a sucção do ar e do suco simultaneamente dobra de valor.,"densidade do ar é menor que a do suco, portanto, o volume de ar aspirado é muito maior que o volume de suco.","velocidade com que o suco sobe deve ser constante nos dois canudos, o que é impossível com um dos canudos de fora.","peso da coluna de suco é consideravelmente maior que o peso da coluna de ar, o que dificulta a sucção do líquido.",pressão no interior da boca assume praticamente o mesmo valor daquela que atua sobre o su co.
QUESTÃO 104,"O alemão Fritz Haber recebeu o Prêmio Nobel de química de 1918 pelo desenvolvimento de um processo viável para a síntese da amônia (NH 3). Em seu discurso de premiação, Haber justificou a importância do feito dizendo que: “Desde a metade do século passado, tornou-se conhecido que um suprimento de nitrogênio é uma necessidade básica para o aumento das safras de alimentos; entretanto, também se sabia que as plantas não podem absorver o nitrogênio em sua forma simples, que é o principal constituinte da atmosfera. Elas precisam que o nitrogênio seja combinado [...] para poderem assimilá-lo. Economias agrícolas basicamente mantêm o balanço do nitrogênio ligado. No entanto, com o advento da era industrial, os produtos do solo são levados de onde cresce a colheita para lugares distantes, onde são consumidos, fazendo com que o nitrogênio ligado não retorne à terra da qual foi retirado. Isso tem gerado a necessidade econômica mundial de abastecer o solo com nitrogênio ligado. [...] A demanda por nitrogênio, tal como a do carvão, indica quão diferente nosso modo de vida se tornou com relação ao das pessoas que, com seus próprios corpos, fertilizam o solo que cultivam. Desde a metade do último século, nós vínhamos aproveitando o suprimento de nitrogênio do salitre que a natureza tinha depositado nos desertos montanhosos do Chile. Comparando o rápido crescimento da demanda com a extensão calculada desses depósitos, ficou claro que em meados do século atual uma emergência seríssima seria inevitável, a menos que a química encontrasse uma saída.” De acordo com os argumentos de Haber, qual fenômeno teria provocado o desequilíbrio no “balanço do nitrogênio ligado”?",O esgotamento das reservas de salitre no Chile.,O aumento da exploração de carvão vegetal e carvão mineral.,A redução da fertilidade do solo nas economias agrícolas.,A intensificação no fluxo de pessoas do campo para as cidades.,A necessidade das plantas de absorverem sais de nitrogênio disponíveis no solo.
QUESTÃO 105,"A polinização, que viabiliza o transporte do grão de pólen de uma planta até o estigma de outra, pode ser realizada biótica ou abioticamente. Nos processos abióticos, as plantas dependem de fatores como o vento e a água. A estratégia evolutiva que resulta em polinização mais eficiente quando esta depende do vento é o(a)",diminuição do cálice.,alongamento do ovário.,disponibilização do néctar.,intensificação da cor das pétalas.,aumento do número de estames.
QUESTÃO 106,"Muitos smartphones e tablets não precisam mais de teclas, uma vez que todos os comandos podem ser dados ao se pressionar a própria tela. Inicialmente essa tecnologia foi proporcionada por meio das telas resistivas, formadas basicamente por duas camadas de material condutor transparente que não se encostam até que alguém as pressione, modificando a resistência total do circuito de acordo com o ponto onde ocorre o toque.  A imagem é uma simplificação do circuito formado pelas placas, em que",e,"representam pontos onde o circuito pode ser fechado por meio do toque. Qual é a resistência equivalente no circuito provocada por um toque que fecha o circuito no ponto A ? A 1,3 quilo-ohm . B 4,0 quilo-ohms .","6,0 quilo-ohms .","6,7 quilo-ohms .","12,0 quilo-ohms ."
QUESTÃO 107,"Companhias que fabricam jeans usam cloro para o clareamento, seguido de lavagem. Algumas estão substituindo o cloro por substâncias ambientalmente mais seguras como peróxidos, que podem ser degradados por enzimas chamadas peroxidases. Pensando nisso, pesquisadores inseriram genes codificadores de peroxidases em leveduras cultivadas nas condições de clareamento e lavagem dos jeans e selecionaram as sobreviventes para produção dessas enzimas. Nesse caso, o uso dessas leveduras modificadas objetiva",reduzir a quantidade de resíduos tóxicos nos efluentes da lavagem.,eliminar a necessidade de tratamento da água consumida.,elevar a capacidade de clareamento dos jeans .,aumentar a resistência do jeans a peróxidos.,associar ação bactericida ao clareamento.
QUESTÃO 108,"Química na saúde Por meio de reações químicas que envolvem carboidratos, lipídeos e proteínas, nossas células obtêm energia e produzem gás carbônico e água. A oxidação da glicose no organismo humano libera energia, conforme ilustra a equação química, sendo que aproximadamente 40 por cento dela é disponibilizada para atividade muscular. Descrição da equação química: Os reagentes C6H 12 O6 (sólido) mais 6 O 2 (gasoso) formam os produtos 6 CO 2 (gasoso) mais 6 H 2 O (líquido). Variação de entalpia igual a –2 800 quilojoules. Considere as massas molares (em grama por mol): H igual a 1; C igual a 12; O igual a 16. Na oxidação de 1,0 grama de glicose, a energia obtida para atividade muscular, em quilojoule, é mais próxima de","6,2.","15,6.","70,0.","622,2.","1 12 0,0. Descrição da imagem: Circuito elétrico composto por dois ramos ligados em paralelo, conectados a uma fonte de tensão. Cada ramo possui dois resistores iguais de resistência 4 quilo-ohms. Entre os resistores de cada ramo existe uma chave A que, quando fechada, conecta os dois ramos (na figura, esta chave está aberta). Após os resistores de cada ramo existe uma chave B que, quando fechada, conecta os dois ramos (na figura, esta chave também está abe rta)."
QUESTÃO 109,"Alguns peixes, como o poraquê, a enguia-elétrica da Amazônia, podem produzir uma corrente elétrica quando se encontram em perigo. Um poraquê de 1 metro de comprimento, em perigo, produz uma corrente em torno de 2 ampères e uma voltagem de 600 volts. O quadro apresenta a potência aproximada de equipamentos elétricos. O equipamento elétrico que tem potência similar àquela produzida por esse peixe em perigo é o(a)",exaustor.,computador.,aspirador de pó.,churrasqueira elétrica.,secadora de roupas.
QUESTÃO 110,"Ao pesquisar um resistor feito de um novo tipo de material, um cientista observou o comportamento mostrado no gráfico tensão versus corrente. Após a análise do gráfico, ele concluiu que a tensão em função da corrente é dada pela equação : Tensão é igual a 10 vezes o valor da corrente mais o valor da corrente elevado ao quadrado. O gráfico da resistência elétrica do resistor em função da corrente é","Descrição do gráfico: Gráfico de linha. No eixo horizontal, a corrente elétrica, de 0 a 7 ampères. No eixo vertical, a resistência, de 0 a 20 ohms. Do ponto (0, 10) parte uma linha reta horizontal para o ponto (7, 10).","Descrição do gráfico: Gráfico de linha. No eixo horizontal, a corrente elétrica, de 0 a 7 ampères. No eixo vertical, a resistência, de 10 a 30 ohms. Do ponto (0, 17) parte uma linha reta horizontal para o ponto (7, 17).","Descrição do gráfico: Gráfico de linha. No eixo horizontal, a corrente elétrica, de 0 a 7 ampères. No eixo vertical, a resistência, de 0 a 8 ohms. Do ponto (0, 0) parte uma linha reta em diagonal crescente para o ponto (7, 7).","Descrição do gráfico: Gráfico de linha. No eixo horizontal, a corrente elétrica, de 0 a 7 ampères. No eixo vertical, a resistência, de 8 a 18 ohms. Do ponto (0, 10) parte uma linha reta em diagonal crescente para o ponto (7, 17).","Descrição do gráfico: Gráfico de linha. No eixo horizontal, a corrente elétrica, de 0 a 7 ampères. No eixo vertical, a resistência, de 0 a 60 ohms. Do ponto (0, 10) parte uma linha curva crescente, com concavidade voltada para cima, para o ponto (7, 60). Descrição do quadro: Quadro com alguns equipamentos elétricos e seus valores de potência aproximada em watt. Exaustor: 150. Computador: 300.Aspirador de pó: 600. Churrasqueira elétrica: 1 200. Secadora de roupas: 3 600. Descrição do gráfico: A escala de tensão varia de 0 volt a 120 volts, enquanto a escala de corrente varia de 0 ampère a 7 ampères. O gráfico é uma curva contínua e crescente com uma leve concavidade voltada para cima partindo do ponto (0, 0) e chegando ao ponto (7, 120)."
QUESTÃO 111,"Nas indústrias é muito comum o uso de equipamentos de medição do pH, aparelhos que indicam a molaridade do íon hidrônio (H3O+). Em soluções diluídas, tratadas como ideais, a atividade do íon hidrônio é igual à molaridade desse íon. Para assegurar a precisão desses aparelhos, deve-se calibrá-los com soluções-tampão de pH 4, pH 7 e pH 10. Na calibração desse medidor, a solução-tampão de menor pH apresenta",molaridade do íon hidrônio igual a 4.,elevada concentração de íons OH − livres.,caráter neutro com carência de íons hidrônio.,concentração de íons hidrônio superior à de íons OH− .,aspecto básico com excesso de íons hidrônio em solução.
QUESTÃO 112,"Um estudante relatou que o mapeamento do DNA da cevada foi quase todo concluído e seu código genético desvendado. Chamou atenção para o número de genes que compõem esse código genético e que a semente da cevada, apesar de pequena, possui um genoma mais complexo que o humano, sendo boa parte desse código constituída de sequências repetidas. Nesse contexto, o conceito de código genético está abordado de forma equivocada. Cientificamente esse conceito é definido como",trincas de nucleotídeos que codificam os aminoácidos.,localização de todos os genes encontrados em um genoma.,codificação de sequências repetidas presentes em um genoma.,conjunto de todos os RNAs mensageiros transcritos em um organismo.,todas as sequências de pares de bases presentes em um organismo.
QUESTÃO 113,"As fontes de energia podem ser classificadas de acordo com a origem do recurso e sua capacidade de reposição natural. Apesar de o Brasil ser rico em matrizes energéticas, episódios como os apagões, em alguns estados, e a seca nos reservatórios de hidrelétricas retomaram a discussão sobre a opção de se produzir: i) energia limpa, ii) de baixo impacto ambiental e de contaminação e iii) independente da ação humana para se renovar. Uma fonte de energia que atende aos três critérios mencionados é a",fóssil.,eólica.,hídrica.,nuclear.,biomassa.
QUESTÃO 114,"O nível metabólico de uma célula pode ser determinado pela taxa de síntese de RNAs e proteínas, processos dependentes de energia. Essa diferença na taxa de síntese de biomoléculas é refletida na abundância e características morfológicas dos componentes celulares. Em uma empresa de produção de hormônios proteicos a partir do cultivo de células animais, um pesquisador deseja selecionar uma linhagem com o metabolismo de síntese mais elevado, dentre as cinco esquematizadas na figura. D escrição da figura: Legenda que serve de referência para as demais imagens, com uma membrana plasmática, na qual estão representadas as seguintes estruturas: Mitocôndria, Retículo endoplasmático rugoso, Nucléolo, Eucromatina e Heterocromatina. Abaixo da legenda há 5 linhagens, numeradas de I a V, todas de mesmo tamanho, descritas a seguir: I. Duas mitocôndrias, uma unidade de retículo endoplasmático rugoso, um núcleo pequeno com nucléolo pequeno, eucromatina e grande quantidade de heterocromatina. II. Quatro mitocôndrias, duas unidades de retículo endoplasmático rugoso, um núcleo grande com um nucléolo grande, eucromatina e quantidade média de heterocromatina. III. Quatro mitocôndrias, duas unidades de retículo endoplasmático rugoso, um núcleo pequeno com um nucléolo pequeno, eucromatina e grande quantidade de heterocromatina. IV. Quatro mitocôndrias, quatro unidades de retículo endoplasmático rugoso, um núcleo grande com um nucléolo grande, eucromatina e quantidade pequena de heterocromatina. V. Duas mitocôndrias, uma unidade de retículo endoplasmático rugoso, um núcleo grande com um nucléolo pequeno, eucromatina e quantidade média de heterocromatina. Qual linhagem deve ser escolhida pelo pesquisador?",I,II,III,IV,V
QUESTÃO 115,"O deserto é um bioma que se localiza em regiões de pouca umidade. A fauna é, predominantemente, composta por animais roedores, aves, répteis e artrópodes. Uma adaptação, associada a esse bioma, presente nos seres vivos dos grupos citados é o(a)",existência de numerosas glândulas sudoríparas na epiderme.,eliminação de excretas nitrogenadas de forma concentrada.,desenvolvimento do embrião no interior de ovo com casca.,capacidade de controlar a temperatura corporal.,respiração realizada por pulmões foliáceos.
QUESTÃO 116,"O sulfeto de mercúrio(II) foi usado como pigmento vermelho para pinturas de quadros e murais. Esse pigmento, conhecido como vermilion , escurece com o passar dos anos, fenômeno cuja origem é alvo de pesquisas. Aventou-se a hipótese de que o vermilion  seja decomposto sob a ação da luz, produzindo uma fina camada de mercúrio metálico na superfície. Essa reação seria catalisada por íon cloreto presente na umidade do ar. Segundo a hipótese proposta, o íon cloreto atua na decomposição fotoquímica do vermilion",reagindo como agente oxidante.,deslocando o equilíbrio químico.,diminuindo a energia de ativação.,precipitando cloreto de mercúrio.,absorvendo a energia da luz visível.
QUESTÃO 117,"O sonorizador é um dispositivo físico implantado sobre a superfície de uma rodovia de modo que provoque uma trepidação e ruído quando da passagem de um veículo sobre ele, alertando para uma situação atípica à frente, como obras, pedágios ou travessia de pedestres.  Ao passar sobre os sonorizadores, a suspensão do veículo sofre vibrações que produzem ondas sonoras, resultando em um barulho peculiar. Considere um veículo que passe com velocidade constante igual a 108 quilômetros por hora sobre um sonorizador cujas faixas são separadas por uma distância de 8 centímetros. A frequência da vibração do automóvel percebida pelo condutor durante a passagem nesse sonorizador é mais próxima de","8,6 hertz.","13,5 hertz.",375 hertz.,1 350 hertz.,4 860 hertz.
QUESTÃO 118,"As pessoas que utilizam objetos cujo princípio de funcionamento é o mesmo do das alavancas aplicam uma força, chamada de força potente, em um dado ponto da barra, para superar ou equilibrar uma segunda força, chamada de resistente, em outro ponto da barra. Por causa das diferentes distâncias entre os pontos de aplicação das forças, potente e resistente, os seus efeitos também são diferentes. A figura mostra alguns exemplos desses objetos. Descrição da figura: A figura contém as imagens de cinco objetos: pinça, alicate, quebra-nozes, carrinho de mão e abridor de garrafa. Em qual dos objetos a força potente é maior que a força resistente?",Pinça.,Alicate.,Quebra-nozes.,Carrinho de mão.,Abridor de garrafa.
