question,body,A,B,C,D,E
QUESTÃO 145,"Em 2014 foi inaugurada a maior roda-gigante do mundo, a High Roller , situada em Las Vegas. A figura representa um esboço dessa roda-gigante, no qual o ponto representa uma de suas cadeiras: Descrição da figura: A figura representa um círculo dividido em doze raios. O centro está marcado com a letra O e a extremidade de um raio horizontal à direita está com a letra A, que representa uma cadeira. Um segmento perpendicular vai do centro do círculo até o solo. Uma seta indica que o movimento é anti-horário. A partir da posição indicada, em que o segmento OA  se encontra paralelo ao plano do solo, rotaciona-se a High Roller no sentido anti-horário, em torno do ponto O . Sejam t o ângulo determinado pelo segmento OA em relação à sua posição inicial, e f a função que descreve a altura do ponto A , em relação ao solo, em função de t . Após duas voltas completas, f tem o seguinte gráfico: Descrição do gráfico: No eixo horizontal, que representa tempo em radianos, estão marcados os pontos zero, pi sobre dois, dois pi e quatro pi. No eixo vertical, que representa f em metro, estão marcados os pontos 0, 88 e 168. Uma curva começa no ponto (0 ; 88) e sobe até o ponto (pi sobre 2 ; 168); a partir desse ponto, desce até perto do eixo horizontal e sobe passando pelo ponto (2pi ; 88), sobe até o ponto de ordenada 168, desce até perto do eixo horizontal e sobe até o ponto (4pi ; 88). A expressão da função altura é dada por  ",f de t é igual a 80 vezes seno de t mais 88.,f de t é igual a 80 vezes cosseno de t mais 88.,f de t é igual a 88 vezes cosseno de t mais 168.,f de t é igual a 168 vezes seno de t mais 88 vezes cosseno de t .,f de t é igual a 88 vezes seno de t mais 168 vezes cosseno de t . 
QUESTÃO 146,"Os compositores Pedro, Ricardo e Carlos gravaram um disco com 18 músicas inéditas. Pedro participou da composição de seis músicas, Ricardo participou da composição de oito músicas e Carlos compôs sozinho o restante das músicas. Além disso, Carlos foi parceiro em um terço das músicas compostas por Pedro e em metade das músicas compostas por Ricardo. O número racional que expressa a participação de Carlos na composição das músicas desse disco é",fração de numerador 5 e denominador 9.,fração de numerador 5 e denominador 7.,fração de numerador 1 e denominador 3.,fração de numerador 2 e denominador 7.,fração de numerador 2 e denominador 9.
QUESTÃO 147,"De acordo com um relatório recente da Agência Internacional de Energia (AIE), o mercado de veículos elétricos atingiu um novo marco em 2016, quando foram vendidos mais de 750 mil automóveis da categoria. Com isso, o total de carros elétricos vendidos no mundo alcançou a marca de 2 milhões de unidades desde que os primeiros modelos começaram a ser comercializados em 2011. No Brasil, a expansão das vendas também se verifica. A marca A, por exemplo, expandiu suas vendas no ano de 2016, superando em 360 unidades as vendas de 2015, conforme representado no gráfico. Descrição do gráfico: O eixo horizontal representa o número de carros e o eixo vertical, o ano. 2014: desenho de um carro. 2015: desenho de dois carros.2016: desenho de cinco carros. A média anual do número de carros vendidos pela marca A, nos anos representados no gráfico, foi de",192.,240.,252.,320.,420.
QUESTÃO 148,"Para apagar os focos A e B de um incêndio, que estavam a uma distância de 30 metros um do outro, os bombeiros de um quartel decidiram se posicionar de modo que a distância de um bombeiro ao foco A, de temperatura mais elevada, fosse sempre o dobro da distância desse bombeiro ao foco B, de temperatura menos elevada. Nestas condições, a maior distância, em metro, que dois bombeiros poderiam ter entre eles é",30.,40.,45.,60.,68.
QUESTÃO 149,"Torneios de tênis, em geral, são disputados em sistema de eliminatória simples. Nesse sistema, são disputadas partidas entre dois competidores, com a eliminação do perdedor e promoção do vencedor para a fase seguinte. Dessa forma, se na primeira fase o torneio conta com 2 n competidores, então na segunda fase restarão n competidores, e assim sucessivamente até a partida final. Em um torneio de tênis, disputado nesse sistema, participam 128 tenistas. Para se definir o campeão desse torneio, o número de partidas necessárias é dado por",2 × 128,64 + 32 + 16 + 8 + 4 + 2,128 + 64 + 32 + 16 + 8 + 4 + 2 + 1,128 + 64 + 32 + 16 + 8 + 4 + 2,64 + 32 + 16 + 8 + 4 + 2 + 1
QUESTÃO 150,"O artigo 33 da lei brasileira sobre drogas prevê a pena de reclusão de 5 a 15 anos para qualquer pessoa que seja condenada por tráfico ilícito ou produção não autorizada de drogas. Entretanto, caso o condenado seja réu primário, com bons antecedentes criminais, essa pena pode sofrer uma redução de um sexto a dois terços. Suponha que um réu primário, com bons antecedentes criminais, foi condenado pelo artigo 33 da lei brasileira sobre drogas. Após o benefício da redução de pena, sua pena poderá variar de",1 ano e 8 meses a 12 anos e 6 meses.,1 ano e 8 meses a 5 anos.,3 anos e 4 meses a 10 anos.,4 anos e 2 meses a 5 anos.,4 anos e 2 meses a 12 anos e 6 meses
QUESTÃO 151,"De acordo com a Lei Universal da Gravitação, proposta por Isaac Newton, a intensidade da força gravitacional F que a Terra exerce sobre um satélite em órbita circular é proporcional à massa m do satélite e inversamente proporcional ao quadrado do raio r da órbita, ou seja, F é igual a fração de numerador k vezes m e denominador r elevado ao quadrado. No plano cartesiano, três satélites, A, B e C, estão representados, cada um, por um ponto (m ; r) cujas coordenadas são, respectivamente, a massa do satélite e o raio da sua órbita em torno da Terra.Descrição da figura: Dois eixos perpendiculares interceptando na origem. O eixo horizontal indica a massa m e o eixo vertical indica o raio r. Três pontos estão representados no plano cartesiano. Os pontos A e B estão localizados na mesma linha paralela ao eixo horizontal, sendo A à esquerda de B. O ponto C está localizado acima do ponto A, na mesma linha vertical e paralela ao eixo vertical. Com base nas posições relativas dos pontos no gráfico, deseja-se comparar as intensidades F índice A, F índice B e F índice C da força gravitacional que a Terra exerce sobre os satélites A, B e C, respectivamente. As intensidades , F índice A, F índice B e F índice C expressas no gráfico satisfazem a relação",F índice C é igual a F índice A menor que F índice B,F índice A é igual a F índice B menor que F índice C,F índice A menor que F índice B menor que F índice C,F índice A menor que F índice C menor que F índice B.,F índice C menor que F índice A menor que F índice B.
QUESTÃO 152,"Os tipos de prata normalmente vendidos são 975, 950 e 925. Essa classificação é feita de acordo com a sua pureza. Por exemplo, a prata 975 é a substância constituída de 975 partes de prata pura e 25 partes de cobre em 1 000 partes da substância. Já a prata 950 é constituída de 950 partes de prata pura e 50 de cobre em 1 000; e a prata 925 é constituída de 925 partes de prata pura e 75 partes de cobre em 1 000. Um ourives possui 10 gramas de prata 925 e deseja obter 40 gramas de prata 950 para produção de uma joia. Nessas condições, quantos gramas de prata e de cobre, respectivamente, devem ser fundidos com os 10 gramas de prata 925?","29,25 e 0,75","28,75 e 1,25","28,50 e 1,50","27,75 e 2,25","25,00 e 5,00"
QUESTÃO 153,"Em um aeroporto, os passageiros devem submeter suas bagagens a uma das cinco máquinas de raio-X disponíveis ao adentrarem a sala de embarque. Num dado instante, o tempo gasto por essas máquinas para escanear a bagagem de cada passageiro e o número de pessoas presentes em cada fila estão apresentados em um painel, como mostrado na figura.Descrição da figura: Figura com cinco retângulos indicando as máquinas e dentro de cada retângulo, o tempo seguido do número de pessoas: Máquina 1: 35 segundos; 5 pessoas. Máquina 2: 25 segundos; 6 pessoas. Máquina 3: 22 segundos; 7 pessoas. Máquina 4: 40 segundos; 4 pessoas. Máquina 5: 20 segundos; 8 pessoas. Um passageiro, ao chegar à sala de embarque desse aeroporto no instante indicado, visando esperar o menor tempo possível, deverá se dirigir à máquina",1,2,3,4,5
QUESTÃO 154,"A Comissão Interna de Prevenção de Acidentes (CIPA) de uma empresa, observando os altos custos com os frequentes acidentes de trabalho ocorridos, fez, a pedido da diretoria, uma pesquisa do número de acidentes sofridos por funcionários. Essa pesquisa, realizada com uma amostra de 100 funcionários, norteará as ações da empresa na política de segurança no trabalho. Os resultados obtidos estão no quadro.Descrição do quadro: Quadro com as seguintes informações: Número de acidentes sofridos: 0; número de trabalhadores: 50. Número de acidentes sofridos: 1; número de trabalhadores: 17. Número de acidentes sofridos: 2; número de trabalhadores: 15. Número de acidentes sofridos: 3; número de trabalhadores: 10. Número de acidentes sofridos: 4; número de trabalhadores: 6. Número de acidentes sofridos: 5; número de trabalhadores: 2. A média do número de acidentes por funcionário na amostra que a CIPA apresentará à diretoria da empresa é","0,15.","0,30."," 0,50.","1,11.","2,22."
QUESTÃO 155,"A rosa dos ventos é uma figura que representa oito sentidos, que dividem o círculo em partes iguais. Descrição da figura: Figura formada por dois círculos concêntricos. No maior, estão traçados dois diâmetros perpendiculares, um na vertical e outro na horizontal. Na extremidade superior do diâmetro vertical está a letra N (Norte) e na extremidade inferior, a letra S (Sul). Na extremidade à esquerda do diâmetro horizontal está a letra O (Oeste) e na extremidade à direita, a letra L (Leste). No círculo menor estão traçados dois diâmetros inclinados e perpendiculares. Na extremidade superior do diâmetro inclinado à esquerda estão as letras NO (Noroeste) e na extremidade inferior à direita estão as letras SE (Sudeste). No outro diâmetro inclinado há, na extremidade superior à direita, as letras NE (Nordeste) e na extremidade inferior à esquerda estão as letras SO (Sudoeste). Uma câmera de vigilância está fixada no teto de um shopping e sua lente pode ser direcionada remotamente, através de um controlador, para qualquer sentido. A lente da câmera está apontada inicialmente no sentido Oeste e o seu controlador efetua três mudanças consecutivas, a saber: Primeira mudança: 135 graus no sentido anti-horário; Segunda mudança: 60 graus no sentido horário; Terceira mudança: 45 graus no sentido anti-horário. Após a terceira mudança, ele é orientado a reposicionar a câmera, com a menor amplitude possível, no sentido Noroeste (NO) devido a um movimento suspeito de um cliente. Qual mudança de sentido o controlador deve efetuar para reposicionar a câmera?",75 graus no sentido horário.,105 graus no sentido anti-horário.,120 graus no sentido anti-horário.,135 graus no sentido anti-horário.,165 graus no sentido horário.
QUESTÃO 156,"Na teoria das eleições, o Método de Borda sugere que, em vez de escolher um candidato, cada juiz deve criar um ranking de sua preferência para os concorrentes (isto é, criar uma lista com a ordem de classificação dos concorrentes). A este ranking é associada uma pontuação: um ponto para o último colocado no ranking, dois pontos para o penúltimo, três para o antepenúltimo, e assim sucessivamente. Ao final, soma-se a pontuação atribuída a cada concorrente por cada um dos juízes. Em uma escola houve um concurso de poesia no qual cinco alunos concorreram a um prêmio, sendo julgados por 25 juízes. Para a escolha da poesia vencedora foi utilizado o Método de Borda. Nos quadros, estão apresentados os rankings dos juízes e a frequência de cada ranking. Descrição do quadro: Quadro com as informações: “Ranking” e “Colocações”. Ranking I: 1o  Ana; 2oBia; 3o  Caio; 4o  Dani; 5o  Edu. Ranking II: 1o  Dani; 2o Caio; 3o  Edu; 4o  Ana; 5o  Bia. Ranking III: 1o  Bia; 2oAna; 3o  Caio; 4o  Edu; 5o  Dani. Ranking IV: 1o  Edu; 2oAna; 3o  Dani; 4o  Bia; 5o  Caio.Descrição do quadro: Quadro com as seguintes informações: Ranking: I; Frequência: 4. Ranking: II; Frequência: 9. Ranking: III; Frequência: 7. Ranking: IV; Frequência: 5. A poesia vencedora foi a de",Edu,Dani,Caio,Bia,Ana
QUESTÃO 157,"Sobre um sistema cartesiano considera-se uma malha formada por circunferências de raios com medidas dadas por números naturais e por 12 semirretas com extremidades na origem, separadas por ângulos de fração de numerador pi e denominador seis radianos, conforme a figura.Descrição da figura: No plano cartesiano estão marcados o ponto A da malha, localizado na interseção entre a circunferência de raio 6 e a semirreta que forma um ângulo de fração de numerador 5 vezes pi e denominador 6 radianos com o semieixo positivo das abscissas, e o ponto B localizado na interseção entre a circunferência de raio 4 e a semirreta que forma um ângulo de fração de numerador pi e denominador 6 radianos com o semieixo positivo das abscissas. Suponha que os objetos se desloquem apenas pelas semirretas e pelas circunferências dessa malha, não podendo passar pela origem (0, 0). Considere o valor de pi com aproximação de, pelo menos, uma casa decimal. Para realizar o percurso mais curto possível ao longo da malha, do ponto B até o ponto A, um objeto deve percorrer uma distância igual a","abre parêntese fração de numerador 2 vezes pi vezes 1 e denominador 3 fecha parêntese, mais 8.","abre parêntese fração de numerador 2 vezes pi vezes 2 e denominador 3 fecha parêntese, mais 6.","abre parêntese fração de numerador 2 vezes pi vezes 3 e denominador 3 fecha parêntese, mais 4.","abre parêntese fração de numerador 2 vezes pi vezes 4 e denominador 3 fecha parêntese, mais 2.","abre parêntese fração de numerador 2 vezes pi vezes 5 e denominador 3 fecha parêntese, mais 2."
QUESTÃO 158,"Um artesão possui potes cilíndricos de tinta cujas medidas externas são 4 centímetros de diâmetro e 6 centímetros de altura. Ele pretende adquirir caixas organizadoras para armazenar seus potes de tinta, empilhados verticalmente com tampas voltadas para cima, de forma que as caixas possam ser fechadas. No mercado, existem cinco opções de caixas organizadoras, com tampa, em formato de paralelepípedo reto retângulo, vendidas pelo mesmo preço, possuindo as seguintes dimensões internas: Descrição do quadro: Quadro com as informações: Modelo, Comprimento, Largura e Altura, em centímetro: Modelo I: Comprimento 8; Largura 8; Altura 40. Modelo II: Comprimento 8; Largura 20; Altura 14. Modelo III: Comprimento 18; Largura 5; Altura 35. Modelo IV: Comprimento 20; Largura 12; Altura 12. Modelo V: Comprimento 24; Largura 8; Altura 14. Qual desses modelos o artesão deve adquirir para conseguir armazenar o maior número de potes por caixa?",I,II,III,IV,V
QUESTÃO 159,"A prefeitura de um pequeno município do interior decide colocar postes para iluminação ao longo de uma estrada retilínea, que inicia em uma praça central e termina numa fazenda na zona rural. Como a praça já possui iluminação, o primeiro poste será colocado a 80 metros da praça, o segundo, a 100 metros, o terceiro, a 120 metros, e assim sucessivamente, mantendo-se sempre uma distância de vinte metros entre os postes, até que o último poste seja colocado a uma distância de 1 380 metros da praça. Se a prefeitura pode pagar, no máximo, R$ 8 000,00 por poste colocado, o maior valor que poderá gastar com a colocação desses postes é","R$ 512 000,00.","R$ 520 000,00.","R$ 528 000,00","R$ 552 000,00","R$ 584 000,00"
QUESTÃO 160,"Um edifício tem a numeração dos andares iniciando no térreo (T ), e continuando com primeiro, segundo, terceiro, ..., até o último andar. Uma criança entrou no elevador e, tocando no painel, seguiu uma sequência de andares, parando, abrindo e fechando a porta em diversos andares. A partir de onde entrou a criança, o elevador subiu sete andares, em seguida desceu dez, desceu mais treze, subiu nove, desceu quatro e parou no quinto andar, finalizando a sequência. Considere que, no trajeto seguido pela criança, o elevador parou uma vez no último andar do edifício. De acordo com as informações dadas, o último andar do edifício é o",décimo sexto.,vigésimo segundo,vigésimo terceiro.,vigésimo quinto,trigésimo segundo.
QUESTÃO 161,"O Salão do Automóvel de São Paulo é um evento no qual vários fabricantes expõem seus modelos mais recentes de veículos, mostrando, principalmente, suas inovações em design e tecnologia. Uma montadora pretende participar desse evento com dois estandes, um na entrada e outro na região central do salão, expondo, em cada um deles, um carro compacto e uma caminhonete. Para compor os estandes, foram disponibilizados pela montadora quatro carros compactos, de modelos distintos, e seis caminhonetes de diferentes cores para serem escolhidos aqueles que serão expostos. A posição dos carros dentro de cada estande é irrelevante. Uma expressão que fornece a quantidade de maneiras diferentes que os estandes podem ser compostos é",arranjo de 10 elementos tomados 4 a 4.,combinação de 10 elementos tomados 4 a 4.,combinação de 4 elementos tomados 2 a 2 vezes combinação de 6 elementos tomados 2 a 2 vezes 2 vezes 2.,arranjo de 4 elementos tomados 2 a 2 vezes arranjo de 6 elementos tomados 2 a 2 vezes 2 vezes 2,combinação de 4 elementos tomados 2 a 2 vezes combinação de 6 elementos tomados 2 a 2.
QUESTÃO 162,"Os alunos da disciplina de estatística, em um curso universitário, realizam quatro avaliações por semestre com os pesos de 20 por cento, 10 por cento, 30 por cento e 40 por cento, respectivamente. No final do semestre, precisam obter uma média nas quatro avaliações de, no mínimo, 60 pontos para serem aprovados. Um estudante dessa disciplina obteve os seguintes pontos nas três primeiras avaliações: 46, 60 e 50, respectivamente. O mínimo de pontos que esse estudante precisa obter na quarta avaliação para ser aprovado é","29,8","71,0.","74,5.","75,5.","84,0."
QUESTÃO 163,"O gerente do setor de recursos humanos de uma empresa está organizando uma avaliação em que uma das etapas é um jogo de perguntas e respostas. Para essa etapa, ele classificou as perguntas, pelo nível de dificuldade, em fácil, médio e difícil, e escreveu cada pergunta em cartões para colocação em uma urna. Contudo, após depositar vinte perguntas de diferentes níveis na urna, ele observou que 25 por cento delas eram de nível fácil. Querendo que as perguntas de nível fácil sejam a maioria, o gerente decidiu acrescentar mais perguntas de nível fácil à urna, de modo que a probabilidade de o primeiro participante retirar, aleatoriamente, uma pergunta de nível fácil seja de 75 por cento. Com essas informações, a quantidade de perguntas de nível fácil que o gerente deve acrescentar à urna é igual a",10,15,35,40,45
QUESTÃO 164,"A Transferência Eletrônica Disponível (TED) é uma transação financeira de valores entre diferentes bancos. Um economista decide analisar os valores enviados por meio de TEDs entre cinco bancos (1, 2, 3, 4 e 5) durante um mês. Para isso, ele dispõe esses valores em uma matriz A é igual abre colchete, a índice i j fecha colchete, em que 1 é menor ou igual a i e menor ou igual a 5 e 1 é menor ou igual a j e menor ou igual a 5, e o elemento a índice i j corresponde ao total proveniente das operações feitas via TED, em milhão de real, transferidos do banco i para o banco j durante o mês. Observe que o elemento a índice i i é igual a zero, uma vez que TED é uma transferência entre bancos distintos. Essa é a matriz obtida para essa análise: Descrição da matriz A de cinco colunas e cinco linhas: Primeira linha: 0, 2, 0, 2, 2. Segunda linha: 0, 0, 2, 1, 0. Terceira linha: 1, 2, 0, 1, 1. Quarta linha: 0, 2, 2, 0, 0. Quinta linha: 3, 0, 1, 1, 0.  Com base nessas informações, o banco que transferiu a maior quantia via TED é o banco",1,2,3,4,5
QUESTÃO 165,"Um contrato de empréstimo prevê que quando uma parcela é paga de forma antecipada, conceder-se-á uma redução de juros de acordo com o período de antecipação. Nesse caso, paga-se o valor presente, que é o valor, naquele momento, de uma quantia que deveria ser paga em uma data futura. Um valor presente P submetido a juros compostos com taxa i, por um período de tempo n, produz um valor futuro V determinado pela fórmula V é igual a P vezes abre parêntese 1 mais i fecha parêntese elevado a n Em um contrato de empréstimo com sessenta parcelas fixas mensais, de R$ 820,00, a uma taxa de juros de 1,32 por cento ao mês, junto com a trigésima parcela será paga antecipadamente uma outra parcela, desde que o desconto seja superior a 25 por cento do valor da parcela. Utilize 0,2877 como aproximação para logaritmo neperiano da fração numerador 4 e denominador 3 e 0,0131 como aproximação para logaritmo neperiano de 1,0132. A primeira das parcelas que poderá ser antecipada junto com a trigésima é a",quinquagésima sexta.,quinquagésima quinta,quinquagésima segunda.,quinquagésima primeira.,quadragésima quinta.
QUESTÃO 166,"Um jogo pedagógico utiliza-se de uma interface algébrico-geométrica do seguinte modo: os alunos devem eliminar os pontos do plano cartesiano dando “tiros”, seguindo trajetórias que devem passar pelos pontos escolhidos. Para dar os tiros, o aluno deve escrever em uma janela do programa a equação cartesiana de uma reta ou de uma circunferência que passa pelos pontos e pela origem do sistema de coordenadas. Se o tiro for dado por meio da equação da circunferência, cada ponto diferente da origem que for atingido vale 2 pontos. Se o tiro for dado por meio da equação de uma reta, cada ponto diferente da origem que for atingido vale 1 ponto. Em uma situação de jogo, ainda restam os seguintes pontos para serem eliminados: A(0 ; 4), B(4 ; 4), C(4 ; 0), D(2 ; 2) e E(0 ; 2). Descrição do plano cartesiano: No eixo horizontal (x) estão marcados os pontos: 0, 1, 2, 3, 4, 5 e 6. No eixo vertical (y) estão marcados os pontos: 0, 1, 2, 3, 4 e 5. Há os seguintes pontos marcados no plano cartesiano: ponto de coordenadas (0 ; 0); ponto A, de coordenadas (0 ; 4); ponto B, de coordenadas (4 ; 4); ponto C, de coordenadas (4 ; 0); ponto D, de coordenadas (2 ; 2) e ponto E, de coordenadas (0 ; 2). Passando pelo ponto A, qual equação forneceria a maior pontuação?",x é igual a 0.,y é igual a 0,x elevado ao quadrado mais y elevado ao quadrado é igual a 16.,x elevado ao quadrado mais abre parêntese y menos 2 fecha parêntese elevado ao quadrado é igual a 4.,abre parêntese x menos 2 fecha parêntese elevado ao quadrado mais abre parêntese y menos 2 fecha parêntese elevado ao quadrado é igual a 8.
QUESTÃO 167,"Devido ao não cumprimento das metas definidas para a campanha de vacinação contra a gripe comum e o vírus H1N1 em um ano, o Ministério da Saúde anunciou a prorrogação da campanha por mais uma semana. A tabela apresenta as quantidades de pessoas vacinadas dentre os cinco grupos de risco até a data de início da prorrogação da campanha. Descrição da tabela: Tabela “Balanço parcial nacional da vacinação contra a gripe” de quatro colunas e seis linhas: Grupo de risco: Crianças; Profissionais de saúde; Gestantes; Indígenas; Idosos. População (milhão): 4,5; 2,0; 2,5; 0,5; 20,5. População já vacinada (milhão): 0,9; 1,0; 1,5; 0,4; 8,2. População já vacinada (porcentagem): 20; 50; 60; 80; 40. Qual é a porcentagem do total de pessoas desses grupos de risco já vacinadas?",12,18,30,40,50
QUESTÃO 168,"Durante uma festa de colégio, um grupo de alunos organizou uma rifa. Oitenta alunos faltaram à festa e não participaram da rifa. Entre os que compareceram, alguns compraram três bilhetes, 45 compraram 2 bilhetes, e muitos compraram apenas um. O total de alunos que comprou um único bilhete era 20 por cento do número total de bilhetes vendidos, e o total de bilhetes vendidos excedeu em 33 o número total de alunos do colégio. Quantos alunos compraram somente um bilhete?",34,42,47,48,79
QUESTÃO 169,"Um quebra-cabeça consiste em recobrir um quadrado com triângulos retângulos isósceles, como ilustra a figura. Descrição da figura: Um quadrado com uma diagonal que liga o vértice inferior esquerdo ao vértice superior direito. A parte acima dessa diagonal está preenchida por um triângulo retângulo isósceles e a parte abaixo está preenchida por seis triângulos retângulos isósceles de tamanhos variados da seguinte forma: o triângulo menor está localizado no canto inferior direito do quadrado com seus catetos sobre os lados do quadrado, sua hipotenusa forma um dos catetos do segundo triângulo, a hipotenusa deste forma um dos catetos do terceiro, a hipotenusa deste forma um dos catetos do quarto, a hipotenusa deste forma um dos catetos do quinto e a hipotenusa deste é uma das partes da diagonal do quadrado. O sexto triângulo complementa a parte abaixo da diagonal do quadrado. Uma artesã confecciona um quebra-cabeça como o descrito, de tal modo que a menor das peças é um triângulo retângulo isósceles cujos catetos medem 2 centímetros. O quebra-cabeça, quando montado, resultará em um quadrado cuja medida do lado, em centímetro, é",14,12,7 vezes raiz quadrada de 2.,6 mais 4 vezes raiz quadrada de 2.,6 mais 2 vezes raiz quadrada de 2.
