question,body,A,B,C,D,E
QUESTÃO 119,"Na mitologia grega, Nióbia era a filha de Tântalo, dois personagens conhecidos pelo sofrimento. O elemento químico de número atômico (Z) igual a 41 tem propriedades químicas e físicas tão parecidas com as do elemento de número atômico 73 que chegaram a ser confundidos. Por isso, em homenagem a esses dois personagens da mitologia grega, foi conferido a esses elementos os nomes de nióbio (Z igual a 41) e tântalo (Z igual a 73). Esses dois elementos químicos adquiriram grande importância econômica na metalurgia, na produção de supercondutores e em outras aplicações na indústria de ponta, exatamente pelas propriedades químicas e físicas comuns aos dois. A importância econômica e tecnológica desses elementos, pela similaridade de suas propriedades químicas e físicas, deve-se a",terem elétrons no subnível f .,serem elementos de transição interna.,pertencerem ao mesmo grupo na tabela periódica.,"terem seus elétrons mais externos nos níveis 4 e 5, respectivamente.","estarem localizados na família dos alcalinos terrosos e alcalinos, respectivamente."
QUESTÃO 120,A investigação de alterações morfológicas que ocorrem em macrófitas aquáticas presentes em lagoas indicou uma redução na cutícula desses vegetais associada à permanência em água doce. Qual é a função adaptativa dessa característica morfológica?,Ampliar a captação de luz solar.,Possibilitar a flutuação do vegetal.,Melhorar a captação de nutrientes.,Facilitar as trocas de gases respiratórios.,Aumentar a captação de seiva bruta pelo vegetal.
QUESTÃO 121,"O cruzamento de duas espécies da família das Anonáceas, a cherimoia ( Annona cherimola ) com a fruta-pinha ( Annona squamosa ), resultou em uma planta híbrida denominada de atemoia. Recomenda-se que o seu plantio seja por meio de enxertia. Um dos benefícios dessa forma de plantio é a",ampliação da variabilidade genética.,produção de frutos das duas espécies.,manutenção do genótipo da planta híbrida.,reprodução de clones das plantas parentais.,modificação do genoma decorrente da transgenia.
QUESTÃO 122,"O processo de obtenção de energia elétrica está passando por grandes discussões em países como Estados Unidos, Alemanha e Japão após o acidente ocorrido na usina de Fukushima em 2011, pois eles possuem sua matriz energética fortemente baseada na utilização de energia nuclear. Esta fonte energética, não renovável, é obtida pela energia liberada de núcleos atômicos de elementos químicos radiativos, como o urânio, que se partem durante um processo de reação em cadeia controlada que ocorre no interior de um reator nuclear. A energia liberada é absorvida pela água, que vaporizada movimenta um gerador elétrico. Para o processo de obtenção de energia apresentado, o processo físico, no interior do reator, é conhecido como",fusão.,fissão.,transmutação.,ionização.,aniquilação.
QUESTÃO 123,"A utilização de extratos de origem natural tem recebido a atenção de pesquisadores em todo o mundo, principalmente nos países em desenvolvimento que são altamente acometidos por doenças infecciosas e parasitárias. Um bom exemplo dessa utilização são os produtos de origem botânica que combatem insetos. O uso desses produtos pode auxiliar no controle da",esquistossomose.,leptospirose.,leishmaniose.,hanseníase.,aids.
QUESTÃO 124,"Nos manuais de instalação de equipamentos de som há o alerta aos usuários para que observem a correta polaridade dos fios ao realizarem as conexões das caixas de som. As figuras ilustram o esquema de conexão das caixas de som de um equipamento de som mono, no qual os alto-falantes emitem as mesmas ondas. No primeiro caso, a ligação obedece às especificações do fabricante e no segundo mostra uma ligação na qual a polaridade está invertida. Descrição das figuras: As figuras apresentam dois esquemas de ligação de um equipamento de som com duas conexões, sendo uma para o alto-falante esquerdo ( E ) e a outra para o alto-falante direito ( D ). Cada conexão possui um polo positivo e outro negativo. O primeiro esquema, denominado polaridade correta, apresenta fios ligando os polos positivo com positivo e negativo com negativo das conexões do equipamento com cada alto-falante. No segundo esquema, denominado polaridade invertida, o alto-falante da esquerda está ligado conforme a primeira imagem, enquanto o alto-falante da direita apresenta o polo positivo ligado ao polo negativo do equipamento, bem como o polo negativo ligado ao polo positivo do equipamento.  O que ocorre com os alto-falantes E e D se forem conectados de acordo com o segundo esquema?",O alto-falante E funciona normalmente e o D entra em curto-circuito e não emite som.,O alto-falante E emite ondas sonoras com frequências ligeiramente diferentes do alto-falante D provocando o fenômeno de batimento.,O alto-falante E emite ondas sonoras com frequências e fases diferentes do alto-falante D provocando o fenômeno conhecido como ruído. ,O alto-falante E emite ondas sonoras que apresentam um lapso de tempo em relação às emitidas pelo alto-falante D  provocando o fenômeno de reverberação., O alto-falante E emite ondas sonoras em oposição de fase às emitidas pelo alto-falante D provocando o fenômeno de interferência destrutiva nos pontos equidistantes aos alto-falantes.
QUESTÃO 125,"As pilhas de Bagdá Em 1938 o arqueólogo alemão Wilhelm König, diretor do Museu Nacional do Iraque, encontrou um objeto estranho na coleção da instituição, que poderia ter sido usado como uma pilha, similar às utilizadas em nossos dias. A suposta pilha, datada de cerca de 200 anos antes de Cristo, é constituída de um pequeno vaso de barro (argila) no qual foram instalados um tubo de cobre, uma barra de ferro (aparentemente corroída por ácido) e uma tampa de betume (asfalto), conforme ilustrado. Considere que os potenciais-padrão de redução do ferro (Fe de carga 2 + para Fe), do hidrogênio (H de carga positiva para H 2) e do cobre (Cu de carga 2 + para Cu) são, respectivamente, iguais a − 0,44 volt, 0,00 volt e +0,34 volt.Descrição da imagem: Um vaso de barro bojudo, de gargalo estreito na parte superior. Nesse gargalo está inserido um tubo de cobre. Dentro do tubo há uma barra de ferro que não está em contato com o cobre. Ambos estão fixados com uma tampa de betume. Tanto o tubo quanto a barra se alongam até um pouco abaixo da metade do vaso. Entre as paredes do vaso e o tubo de cobre há a indicação de vestígios de ácido. Nessa suposta pilha, qual dos componentes atuaria como cátodo?",A tampa de betume.,O vestígio de ácido.,A barra de ferro.,O tubo de cobre.,O vaso de barro.
QUESTÃO 126,"Anabolismo e catabolismo são processos celulares antagônicos, que são controlados principalmente pela ação hormonal. Por exemplo, no fígado a insulina atua como um hormônio com ação anabólica, enquanto o glucagon tem ação catabólica e ambos são secretados em resposta ao nível de glicose sanguínea. Em caso de um indivíduo com hipoglicemia, o hormônio citado que atua no catabolismo induzirá o organismo a",realizar a fermentação lática.,metabolizar aerobicamente a glicose.,produzir aminoácidos a partir de ácidos graxos.,transformar ácidos graxos em glicogênio.,estimular a utilização do glicogênio.
QUESTÃO 127,"Os instrumentos musicais de corda, como a viola,  o violão e o berimbau, funcionam emitindo ondas sonoras produzidas pelas vibrações de suas cordas. Um dos recursos para obter diferentes sons com tais instrumentos é alterar o comprimento das cordas vibrantes, prendendo-as com os dedos no braço do instrumento, como um músico que, ao tocar um violão, modifica a posição de seu dedo para diminuir o comprimento de uma dessas cordas vibrantes. Nessa situação, o som que o músico obterá para essa corda será mais","grave, pois aumenta a tensão na corda.","grave, pois diminui o comprimento de onda na corda.","agudo, pois diminui a amplitude de vibração na corda.","agudo, pois diminui o período de vibração da onda na corda.","agudo, pois aumenta a velocidade de propagação da onda na corda."
QUESTÃO 128,"Quando uma corrente elétrica passa pelo nosso corpo, a ação sobre os nervos e os músculos produz uma reação do nosso corpo a que chamamos choque. A intensidade do choque depende da intensidade da corrente. Quanto maior a intensidade da corrente, mais forte será o choque. Quando uma pessoa está com o corpo molhado, a intensidade da corrente que atravessa o seu corpo aumenta e o choque é mais intenso. O corpo molhado provoca o efeito descrito no texto porque",reduz a resistividade.,reduz a área de contato.,reduz o percurso da corrente elétrica.,aumenta a diferença de potencial elétrico.,aumenta a energia das partículas elétricas.
QUESTÃO 129,"De embalagens a foguetes, o alumínio tem ampla utilidade na vida do ser humano. A principal fonte desse metal é a bauxita, mineral que contém vários óxidos de alumínio, sendo a alumina (Al 2 O3) o principal deles. Após extração e refinamento térmico da bauxita, a alumina obtida é convertida eletroliticamente em alumínio metálico. Essa conversão envolve uma transformação de energia",térmica em elétrica.,elétrica em química.,elétrica em mecânica.,térmica em mecânica.,mecânica em química.
QUESTÃO 130,"A suinocultura é uma atividade importante para a economia brasileira, pois gera emprego e renda em  2 milhões de propriedades rurais. Porém, a preocupação com a poluição do ambiente é uma das maiores ameaças à sua sobrevivência e expansão, pois um suíno adulto produz em média 0,27 metro cúbico por mês de dejetos que constituem risco à saúde da população. Contudo, esses dejetos podem ser utilizados como substratos no processo  de biodigestão. A utilização de biodigestores, na atividade mencionada, proporciona o(a)",redução do consumo de ração.,aumento da produção de suínos.,aumento da emissão de amônia em uma região.,diversificação das técnicas de manejo de suínos.,diversificação da matriz energética de u ma região.
QUESTÃO 131,"Em desenhos animados é comum vermos a personagem tentando impulsionar um barco soprando ar contra a vela para compensar a falta de vento. Algumas vezes usam o próprio fôlego, foles ou ventiladores. Estudantes de um laboratório didático resolveram investigar essa possibilidade. Para isso, usaram dois pequenos carros de plástico, A e B , instalaram sobre estes pequenas ventoinhas e fixaram verticalmente uma cartolina de curvatura parabólica para desempenhar uma função análoga à vela de um barco. No carro B  inverteu-se o sentido da ventoinha e manteve-se a vela, a fim de manter as características físicas do barco, massa e formato da cartolina. A montagem do carro A busca simular a situação dos desenhos animados, pois a ventoinha está direcionada para a vela. A cartolina foi instalada à direita e a ventoinha foi instalada à esquerda, em ambos os carros. Os estudantes ligaram as ventoinhas, aguardaram o fluxo de ar ficar permanente e determinaram os módulos das velocidades médias dos carros A ( V A) e B ( V B ) para o mesmo intervalo de tempo. A respeito das intensidades das velocidades médias e do sentido de movimento  do carro A , os estudantes observaram que:", A Velocidade do carro A é igual a zero; Velocidade do carro B é maior que zero ; o carro A não se move., Zero é menor que a velocidade do carro A e a velocidade do carro A é menor que a velocidade do carro B ; o carro A se move para a direita.,Zero é menor que a velocidade do carro A e a velocidade do carro A é menor que a velocidade do carro B ; o carro A se move para a esquerda.,Zero é menor que a velocidade do carro B e a velocidade do carro B é menor que a velocidade do carro A ; o carro A se move para a direita.,Zero é menor que a velocidade do carro B e a velocidade do carro B é menor que a velocidade do carro A ; o carro A se move para a esquerda.
QUESTÃO 132,"Elementos da natureza e propriedades dos solos O manejo adequado do solo possibilita a manutenção de sua fertilidade à medida que as trocas de nutrientes entre matéria orgânica, água, solo e o ar são mantidas para garantir a produção. Algumas espécies iônicas de alumínio são tóxicas, não só para a planta, mas para muitos organismos como as bactérias responsáveis pelas transformações no ciclo do nitrogênio. O alumínio danifica as membranas das células das raízes e restringe a expansão de suas paredes, com isso, a planta não cresce adequadamente. Para promover benefícios para a produção agrícola, é recomendada a remediação do solo utilizando calcário (CaCO 3). Essa remediação promove no solo o(a)","diminuição do pH, deixando-o fértil.","solubilização do alumínio, ocorrendo sua lixiviação pela chuva.","interação do íon cálcio com o íon alumínio, produzindo uma liga metálica.","reação do carbonato de cálcio com os íons alumínio, formando alumínio metálico.","aumento da sua alcalinidade, tornando os íons alumínio menos disponíveis."
QUESTÃO 133,"Visando a melhoria estética de um veículo, o vendedor de uma loja sugere ao consumidor que ele troque as rodas de seu automóvel de aro 15 polegadas para aro 17 polegadas, o que corresponde a um diâmetro maior do conjunto roda e pneu. Duas consequências provocadas por essa troca de aro são:",Elevar a posição do centro de massa do veículo tornando-o mais instável e aumentar a velocidade do automóvel em relação à indicada no velocímetro.,Abaixar a posição do centro de massa do veículo tornando-o mais instável e diminuir a velocidade do automóvel em relação à indicada no velocímetro.,Elevar a posição do centro de massa do veículo tornando-o mais estável e aumentar a velocidade do automóvel em relação à indicada no velocímetro.,Abaixar a posição do centro de massa do veículo tornando-o mais estável e diminuir a velocidade do automóvel em relação à indicada no velocímetro.,Elevar a posição do centro de massa do veículo tornando-o mais estável e diminuir a velocidade do automóvel em relação à indicad a no velocímetro.
QUESTÃO 134,"As células e os organismos precisam realizar trabalho para permanecerem vivos e se reproduzirem. A energia metabólica necessária para a realização desse trabalho é oriunda da oxidação de combustíveis, gerados no ciclo do carbono, por meio de processos capazes de interconverter diferentes formas da energia. Descrição do fluxograma: Fluxograma cíclico composto por quatro caixas de textos interligadas por setas que apontam no sentido horário. Do “Processo 1” parte uma seta para “Combustíveis reduzidos e O2”, de onde parte outra seta para “Processo 2”, de onde parte outra seta para “CO2 e H 2O”, fechando o ciclo com uma seta que retorna ao “Processo 1”. Nesse ciclo, a formação de combustíveis está vinculada à conversão de energia",térmica em cinética.,química em térmica.,eletroquímica em calor.,cinética em eletromagnética.,eletromagnética em química.
QUESTÃO 135,"O petróleo é uma fonte de energia de baixo custo e de larga utilização como matéria-prima para uma grande variedade de produtos. É um óleo formado de várias substâncias de origem orgânica, em sua maioria hidrocarbonetos de diferentes massas molares. São utilizadas técnicas de separação para obtenção dos componentes comercializáveis do petróleo. Além disso, para aumentar a quantidade de frações comercializáveis, otimizando o produto de origem fóssil, utiliza-se o processo de craqueamento. O que ocorre nesse processo?",Transformação das frações do petróleo em outras moléculas menores.,Reação de óxido-redução com transferência de elétrons entre as moléculas.,Solubilização das frações do petróleo com a utilização de diferentes solventes.,Decantação das moléculas com diferentes massas molares pelo uso de centrífugas.,Separação dos diferentes componentes do petróleo em função de suas temperaturas de ebulição. 
QUESTÃO 136,"Numa atividade de treinamento realizada no Exército de um determinado país, três equipes – Alpha, Beta e Gama – foram designadas a percorrer diferentes caminhos, todos com os mesmos pontos de partida e de chegada. • A equipe Alpha realizou seu percurso em 90 minutos com uma velocidade média de 6,0 quilômetros por hora. • A equipe Beta também percorreu sua trajetória em 90 minutos, mas sua velocidade média foi de 5,0 quilômetros por hora. • Com uma velocidade média de 6,5 quilômetros por hora , a equipe Gama concluiu seu caminho em 60 minutos. Com base nesses dados, foram comparadas as distâncias dBeta ; dAlpha e dGama percorridas pelas três equipes. A ordem das distâncias percorridas pelas equipes Alpha, Beta e Gama é",dGama menor que dBeta menor que dAlpha.,dAlpha igual a dBeta menor que dGama.,dGama menor que dBeta igual a dAlpha.,dBeta menor que dAlpha menor que dGama.,dGama menor que dAlpha menor que dBeta.
QUESTÃO 137,"O colesterol total de uma pessoa é obtido pela soma da taxa do seu “colesterol bom” com a taxa do seu “colesterol ruim”. Os exames periódicos, realizados em um paciente adulto, apresentaram taxa normal de “colesterol bom”, porém, taxa do “colesterol ruim” (também chamado LDL) de 280 miligramas por decilitro . O quadro apresenta uma classificação de acordo com as taxas de LDL em adultos. Descrição do quadro: Quadro intitulado “Taxa de LDL (miligrama por decilitro)” com as seguintes informações: Ótima: menor do que 100. Próxima de ótima: de 100 a 129.Limite: de 130 a 159. Alta: de 160 a 189. Muito alta: 190 ou mais. O paciente, seguindo as recomendações médicas sobre estilo de vida e alimentação, realizou o exame logo após o primeiro mês, e a taxa de LDL reduziu 25 por cento. No mês seguinte, realizou novo exame e constatou uma redução de mais 20 por cento na taxa de LDL. De acordo com o resultado do segundo exame, a classificação da taxa de LDL do paciente é",ótima.,próxima de ótima.,limite.,alta.,muito alta.
QUESTÃO 138,"Uma empresa deseja iniciar uma campanha publicitária divulgando uma promoção para seus possíveis consumidores. Para esse tipo de campanha, os meios mais viáveis são a distribuição de panfletos na rua e anúncios na rádio local. Considera-se que a população alcançada pela distribuição de panfletos seja igual à quantidade de panfletos distribuídos, enquanto que a alcançada por um anúncio na rádio seja igual à quantidade de ouvintes desse anúncio. O custo de cada anúncio na rádio é de R$ 120,00, e a estimativa é de que seja ouvido por 1 500 pessoas. Já a produção e a distribuição dos panfletos custam R$ 180,00 cada 1 000 unidades. Considerando que cada pessoa será alcançada por um único desses meios de divulgação, a empresa pretende investir em ambas as mídias. Considere X e Y os valores (em real) gastos em anúncios na rádio e com panfletos, respectivamente. O número de pessoas alcançadas pela campanha será dado pela expressão","fração de numerador 50 vezes X e denominador 4, mais fração de numerador 50 vezes Y e denominador 9.","fração de numerador 50 vezes X e denominador 9, mais fração de numerador 50 vezes Y e denominador 4.","fração de numerador 4 vezes X e denominador 50, mais fração de numerador 4 vezes Y e denominador 50.","fração de numerador 50 e denominador 4 vezes X, mais fração de numerador 50 e denominador 9 vezes Y .","fração de numerador 50 e denominador 9 vezes X, mais fração de numerador 50 vezes Y e denominador 4 vezes Y ."
QUESTÃO 139,"O remo de assento deslizante é um esporte que faz uso de um barco e dois remos do mesmo tamanho. A figura mostra uma das posições de uma técnica chamada afastamento. Descrição da figura: Figura de um barco com uma pessoa no interior segurando, com as mãos juntas, dois remos de mesmo tamanho. Um ponto A indica o ponto de encontro das extremidades dos dois remos; um ponto B e um ponto C indicam as outras extremidades de cada remo. Nessa posição, os dois remos se encontram no ponto A e suas outras extremidades estão indicadas pelos pontos B e C. Esses três pontos formam um triângulo ABC cujo ângulo BÂC tem medida de 170 graus. O tipo de triângulo com vértices nos pontos A , B e C , no momento em que o remador está nessa posição, é",retângulo escaleno. ,acutângulo escaleno,acutângulo isósceles.,obtusângulo escaleno.,obtusângulo isósceles.
QUESTÃO 140,"Um rapaz estuda em uma escola que fica longe de sua casa, e por isso precisa utilizar o transporte público. Como é muito observador, todos os dias ele anota a hora exata (sem considerar os segundos) em que o ônibus passa pelo ponto de espera. Também notou que nunca consegue chegar ao ponto de ônibus antes de 6 horas e 15 minutos da manhã. Analisando os dados coletados durante o mês de fevereiro, o qual teve 21 dias letivos, ele concluiu que 6 horas e 21 minutos foi o que mais se repetiu, e que a mediana do conjunto de dados é 6 horas e 22 minutos. A probabilidade de que, em algum dos dias letivos de fevereiro, esse rapaz tenha apanhado o ônibus antes de 6 horas e 21 minutos da manhã é, no máximo,",fração de numerador 4 e denominador 21.,fração de numerador 5 e denominador 21.,fração de numerador 6 e denominador 21.,fração de numerador 7 e denominador 21.,fração de numerador 8 e denominador 21.
QUESTÃO 141,"Um mapa é a representação reduzida e simplificada de uma localidade. Essa redução, que é feita com o uso de uma escala, mantém a proporção do espaço representado em relação ao espaço real. Certo mapa tem escala 1 para 58 000 000. Considere que, nesse mapa, o segmento de reta que liga o navio à marca do tesouro meça 7,6 centímetros. A medida real, em quilômetro, desse segmento de reta é",4 408.,7 632.,44 080.,76 316.,440 800.
QUESTÃO 142,"Um produtor de milho utiliza uma área de 160 hectares para as suas atividades agrícolas. Essa área é dividida em duas partes: uma de 40 hectares, com maior produtividade, e outra, de 120 hectares, com menor produtividade.  A produtividade é dada pela razão entre a produção, em tonelada, e a área cultivada. Sabe-se que a área de  40 hectares tem produtividade igual a 2,5 vezes à da outra. Esse fazendeiro pretende aumentar sua produção total em 15 por cento, aumentando o tamanho da sua propriedade. Para tanto, pretende comprar uma parte de uma fazenda vizinha, que possui a mesma produtividade da parte de 120 hectares de suas terras. Qual é a área mínima, em hectare, que o produtor precisará comprar?",36,33,27,24,21
QUESTÃO 143,"A raiva é uma doença viral e infecciosa, transmitida por mamíferos. A campanha nacional de vacinação antirrábica tem o objetivo de controlar a circulação do vírus da raiva canina e felina, prevenindo a raiva humana. O gráfico mostra a cobertura (porcentagem de vacinados) da campanha, em cães, nos anos de 2013, 2015 e 2017, no município de Belo Horizonte, em Minas Gerais. Os valores das coberturas dos anos de 2014 e 2016 não estão informados no gráfico e deseja-se estimá-los. Para tal, levou-se em consideração que a variação na cobertura de vacinação da campanha antirrábica, nos períodos de 2013 a 2015 e de 2015 a 2017, deu-se de forma linear. Descrição do gráfico: 2013: 67 por cento; um segmento de reta inclinado para baixo sai de 67 por cento e chega a 59 por cento. 2014: não representado.2015: 59 por cento; um segmento de reta inclinado para cima sai de 59 por cento e chega a 61 por cento. 2016: não representado.2017: 61 por cento. Qual teria sido a cobertura dessa campanha no ano de 2014?","62,3 por cento.","63,0 por cento.","63,5 por cento.","64,0 por cento.","65,5 por cento."
QUESTÃO 144,"Uma empresa de comunicação tem a tarefa de elaborar um material publicitário de um estaleiro para divulgar um novo navio, equipado com um guindaste de 15 metros de altura e uma esteira de 90 metros de comprimento. No desenho desse navio, a representação do guindaste deve ter sua altura entre 0,5 centímetro e 1 centímetro, enquanto a esteira deve apresentar comprimento superior a 4 centímetros. Todo o desenho deverá ser feito em uma escala 1 para X. Os valores possíveis para X são, apenas,",X maior que 1 500.,X menor que 3 000.,1 500 menor que X menor que  2 250.,1 500 menor que X menor que 3 000.,2 250 menor que X menor que 3 000.
